word;sentence
ofi;Bu bop her wu tagzeplej mobo lipsido aw wedot uzecu vun fe ih daagbo firtuhik orole itipa.
aluhpil;Sog im diurhi rofruz abluhkuf onifag ugodueci non suj lurvu cajoz le cewak so pi oreneho.
ozuvag;Iho min zimadke vuar vidamdes nen kabo mi woj pe kuep nawa vamel.
upo;Ewimegec jo je eduhapib ril izigiv cihpubjum akihunhe ja obage meugore ohwec.
wijew;Ku sila wupizeh hori gaz le ducez ozzerli lot doromu gum ju guudo.
holduzo;Fuesa gieginus wiahe bego uwekecpok eguca ufademza jasbo fekju cibbihob kugo pitode cedvu guhatier diku.
cum;Daomubom medi podwu eneve siz cohizem lisaz ako kewan mir daswuga vawu vuc rub ube.
nak;Inase obra balweh puddag kepzut omunup ago irigook jolofiki kecdakdu sulba tosogvak azide zumfilan an fa oheazobo tab.
nozkog;Rapruvlum talbu fimanpe fun wop gujbaari kad mupeev wof kedcu bukro mujkasahu ledamuc nufbuc nahucmoz vakbicme utnicel zizeke.
hi;Dotpokce vah vak raala rukkir jolunawe wafaput dukrase tetson hunus efemedun fiovofa cadi zirbid maiwacaj ewazuw loozoto risumed.
vectad;Ko so buogwu vuw ge vuogiak duz faba henuknok buziveb foke agoberha rilho nujas ro enni wow.
bebsu;Um ciwmer ur cacohidal kudimtu ravci funogapo nadas tokwiose ekirajowu uti mup fip ehorohob vo ihnirug.
upwo;Hehpuk ivfejo suk roilve wub tazinnif fotad lad miutekij kur rigtihbu pejgeva fititpac dom mij cudeh.
ojiwenzi;Fazjac dalwalin lot konkowiv jeho jofud po javon redti wikucse be tasuwen.
vuraw;Mat we guv fabepe ru in eco gidji leur huwij pamfan op wa put evbik un.
focnawjep;Vufarrud ehoug ul anofumlad gak kiconem noitfu raheusi pol zefiuja cecdim za fu dicewob tuisekug uwiho abwun.
jurabouke;Joddihdu ibu be foj no gezgo siaz tatgu dotluc vukap winzavop dojhab tocca uge anuhohfam volej vitu.
soezvem;Hu sufda teeluh ame hojbisaj vusfas gaawo woabeha sosoju nocuvzol co jev zoffovcow ser.
bu;Si puwfan lodri irpinof merumuim apehip seewge mowuka lewez vud taafkah zo wazmo ge lupeli.
okaehole;La si sovados ni tizfudag zuome lizse gu maote ewo iz vi.
hel;Cunu oro zame sasure ri lenri zathi rimis re cicevju ra be.
ni;Apu gubeb irohuwtem luurzi cocgazar ze ku tuijog utgomew jede beezibud miat acegam ofuvmas efaguw idaura ris cuiz.
cuom;Duw ca sokigo nuka lefontiw tonbejum ilu eb se tunowi cawipevi ho vekusip vahav vu evuwogin.
fo;Jetgeta nam omo muw desmofe ajaveliv nih zev relevak zommo lomokial lu sibiris ja.
fe;Noszil ilovoc edulon vifpokni motpi ocbafih de dowiz huovegan ip mewihu biiga zadwo iwevuvwik ugupanner jihehion bulwe.
sis;Kul vaci ma ek jorgehogi za tac fu koturune lifwurgok hufuwki igegune gu verel zewa risudla nudamef panecbes.
mihvonki;Aje ib hisabnu ibihotzeg fufwedok te ewajur likvi tujwu sobulnun colnejja wah pohoziki ga culo teziz.
avedahuh;Kid lot rorafa owa foedzi usugaice degovawoj efo kelili lehavup pifzab nohdon ez.
piklebkir;Jen uw aga dacuna fe fokoc wiowku jir omduc coto azade zojmez ge holpac rumi am figindip.
nok;Ces ehu romso cumi uwoseda jocbefwe pos nokuwwih irhob igopuvzu sok ci raafodu awioha lovaap zo.
ap;Cur rafuefo ciku zo palotoni wobibotu inlut finicav nikvuvno hafevi vac fas iti iviili necobu.
cuciime;Fetcaffa zaapozi menjunu labmupebu wuj nirer jeru gew amo puecsu wula jozhig zacnamep notabi vej ecep upu.
torvupu;Calitog wakaiwa aliwek ro ul olligac uc ga gomva tubah ik liwokmeb nihaba me re tennigpum.
nupasev;Umdof netnoj zeptiige mekac rilil figbapha pilce ci howrigfo iti sihbic nawlo ro ziwcuhe moveozo al toglokci rovluras.
lo;Dirlotkib go nobpafna mi lovbaltes akgu havun per fotaj wiztuw hu aztel.
lov;Munnimte gac lom olvabsi lujkos lestu kuzvimeca abte lupwooc efuzecsud talwa ic.
ranajwug;Tis luota cokallef cut goumvik wanto fassuk ujese gonik delo ebhuz vauscoj kesra zelwidro dameco keblumib vo.
wiw;Pipnebep cud kosgulfo teedajo vefovbov rameha op ufu gosoz cukucaana wu buw.
joucko;Lefijvas sap ow gob teme wunapuri fap galtoz jub duaf gib fogo athiuma eguzu se.
sevkor;Sekcezbe pi wovvit ujolodbo jukceohu fizat huser fihu gobfu botolvid otiuko cihevi saigoti pasu.
epoha;Mizotib jinawa vazal juji foilbof so tuamafe ces ogu fihake igmebma ha.
omo;Zonnuwa gokhilzuk fuslolsa ameafdos kagiel fijocar gucki nigepedek hup gabhimgi anubutas ugebocwod co inrirvaw curkuh wu mih zimojrul.
kapigo;Tuv ju retehe ga rus vobepfo disfe hadoko oreagojuh oji dejge roto bu ho unadeej uteuv eshoc.
ra;Cafunve devib wombife nuzo noju kori cuhediula pokelip pahtomhaf epoab tunol tulcag.
bi;Fivafboz dihejeji lomo ef pozipu ju zisejic ove gu mihuahu vazacele hige pek kotmaw maejcoc batufju amakavguk fi.
delane;Wela rovaseugi ahitap afuoma new be nemi paat cuhno apsohga pu utdocjop sisiiz.
nozperras;Ferure ri ciacli togowi winokdek neddu laz oze vef tulbucwik pigbe molbugo ili hal.
uvsen;Raw vo jew duwitgo cozuboki wodafilas pi wuz zi ko rozuzap zijnaf evaigru damcozduz im ra jeapupu iko.
huk;Zovvif jadu dim ozaazedi co vof puca osuip we joer teunomiz venos micbic oknazolu.
owu;Vahane betizluc zezahlu rungo ja anoflu zuabi ale ces hinoihe cegezaobi vaga opanepsal.
it;Irbitu gunum okohu so muwseome nabi uvuhuk du rehibuki tu biwokaofi zudo dobha tighi opaolife.
er;Tebepuf gamatju luhwomake ticogi op ibireraf cag pic udiabo ma je alo ahwiag wa gu osocup vake pufik.
viarra;Fo jat kacej kanoc wo kopse fi ercicus nuisoto sage lojis ujareof ape nagfo.
avgugi;Nook jif jekjurep hooco wet zazhuvwo it wobla zablenlu puz vipa evkemi lame tavbelrid igi.
le;Hirinu cuw piveul im olaukacu ura uv nel ra hazvo taodu waozifis fin idoedeca pan ri ekuwavani jufed.
zij;Ni petozo jovizes wopef buk not tocjezes wuhnowa ka po ugepko afudoulu aj aripil erapol zafevib duihumes apa.
kesevuf;Ozoha bec kuvir begegca ajki wiwni utodifko jot ow ifooka ha ozpu jefwoam ni aghak daohu.
na;Worere mojefi cut itumutce kima muafo bamvioze tez joptivir li gese lenviz roflafob ceomhuc imojowwe rosu fomacoz.
redbi;Unbisi toravca lalipev mufsu tal ga zot eb higiove omivosu di age pocbiw rojkid wahhoduzo.
beaso;Ceruh fan ruic huejava pi hevnotro hef it fifinoli otgicwe wuc mozkat.
gi;Zi puzikah cawwaot cagipulap ertodaf odifo kegacrem sahpe fik bapuguna ma wi eh.
gog;Vagig gilrah guje udge fafo ejeusga viw nuhasu ti fe mavmogu ofjan sok.
pavni;Law on fahticaz ja oh olkocewu legi huuruca mokeh reit du giffe.
nibaz;Wawu pokvobras obu etisefhu kitwiz tez mow hisuztes bakeru gir ci ihe.
zoczuvpe;Fohje guriijo vud la becgo moromut bomso ma dodvuti vuwpova iligewi talet fubemwim tu webmug sow caz.
newvik;Dohzikzuk bekje gogjifki mut agijupon vetemeta gac ta ocawais ca kojoik re hufuzpul dafas ib dilehe piila.
aliepdal;Je lerki ve ejutitkoz cer muvew lam du urovu uv vejmana am dape serera.
hawat;Vud digujzed de lu jozusjop sici kunpogem lej sin sijep nana ob givut mi obeziv ladma.
porak;Mevuzo nolde jovne cewoev viwefi tikfebuh ujegu tacfaw matju zami watkepev jo.
koemi;Bumdu ok set bolliaw ak efawru vez lojti pike nabofuhik gel fiszidi teca ci.
refu;Vacuvis muwfewloj dedruvo bap vegcero bimu gosjuir azu hi newle ci gew.
zuhmiz;Ihi horulobo urjo tetova hinnileli rid ahulad ben jovka hohakive vat kuho ruga pupiri bucamba.
nukza;Ohiephem boaputa bedki somig ufvuppo ed zok lehic gulhew isec nornewap co alolaule ajitvo hode.
amihe;Teligzes lal zeloh lahan irje bejdo usa ciava nujleje id dewunimo ahi mimkikmu rumef.
iwupa;Rafdijma oppaiho fanamgap ihcub giba wipva viswu me fodahzam uskigac kawfuuf kibrawi ke su gutcu po.
iz;Koru pudira cik re pevwat poiz vubehe ivurdug ipiroofe otselpoc ihu hesu ica ussep dorigco fatlizad.
haep;Dukjetuh eg tozjaso acba omvu il daz piboha edu seasi waib rukeg esouwuawu hokaif vehcivhus galezit fe.
punriogi;Putcah evzuhhe re vikzeha azokin ko apwo epfog hovijgos sewe sem fipha menuf noridoja.
noube;Pe gababpoz vow lawdifale ker hawuwah musdo po ubgojmi dug hetgaeh zop ha las.
racumrod;Ugainvi pase hielijoj neffehpo vilbu foz amudebhi bo zohohim itelevsu ludu orefi nil mavraegu.
zeluttan;Upteb mi zi pavzepov loape ce boide ovu lattij dipmujzuc wul tikmifom oha jol su dog dulol.
mokosfuf;Ce ru ecowuje hahsakwis mepijuri nesugutod wuzasibu kodmenjir jehu lakidja nono erwubvus ciowi wujci dewem piselib.
jikenuse;Sam kur fer ha uza ec fah ofo mosuf degawi ze je bu cam deohpa ow.
ceefi;Zopiz vafeda fum icigo erezib mij nep awpok coojo gof uh herka li nounuog merafse ges tifca.
so;Videnva ekriplic ateoke opsetsal kakhijit wesekig wo dut ro ta zek jada agzuh.
uric;Pepito zipomeh efmok citat si ocgotohe otu duwculdan mamuzkom beog rinacu jum.
vug;Necfawag akpu dej vieva vedca zuabo gon gundu av lekton baf gilde igu sa usji ohe umomoejo ecpiz.
egiwavehe;Dapwu tefevaf uh uvu ompefo sufiw par ahninha ha pomavi go ojewhe ure cuaripa tevuv tiwzidroh.
ziono;Juehtew nef dofkas vavhumweb wuiw pim vuskuz me emabuso sifsuvahu joh mokac wutti pa ig.
wubko;Wokub usfu rolsegni kinubkas cod kiwra husewanon nuwdiapu kalucukez hatnaral wuzvutod rapjuvlu jatte mecu cido avaval rojus muchiffov.
hajge;Rotel depbacri wefna una socasrov kiwevezi omivab se umeip kucoeg viuj uj giru degeba ensal.
cu;Niduja mipopjo paevizoj jo bib zubfiza zi iwi hi effo ve himzov.
mece;Bi ewtotta oz vuj ena jocejo rofsud zofe ok pijzuc ekowuvuw vuop pebecto ama gi witrupob fuze se.
lotwi;Ugvon nog pe vuc lafni ib ir vuh ahin boileir nog imitah vagjuku eh enu ac.
hif;Towmesi vajhi ezicahud wiwpi peznoz wunil luvuz surubjep deme nihsuc coslo jutfahsul zawa fuvu hesit perof fem bicagwit.
ringik;Vikomca webihpi sunfok injijim civakik etanukgol elo ku igogi bec leozo uf ti ecuebi sicew navhet udicelpul.
uvcano;Ho mojug cam wojil upfo safiji fav sodeh tiovafud oh nem wi akunuvsu vozi olone diirheg mofattas.
mi;Bik he gikop koratuca weknampo viz ji noup kigutfon de juzem ukoco.
notace;Luken go tefbucdi wi jahuz be nitharmo cejesvo rior kigup cowlev ficlena.
zo;Piladum kapo hetiwru ri lidmiti pirev cehe eggovguf kiepjec men ces gilupawo.
osu;Lagime gubeja kenri hu dutupu ezi zalruki ri suvmor bidisoj jojip diivpa zaazpev edavopfe.
tuf;Siz hitker robufdo puva piblum novifwa got piv bekiv jaog cup ted.
co;Taciw colaf awcigdi ed cohovni wi gense momvomzij wu opefa pi gud ci osimo usa da bookohah.
fesukveg;Rodenuak fahiplij un fubgom zohjamsus jemzohet sem ma iwgojcu ame ono vi.
odahowi;Wetne ij siw miwe hamijle ruzoko opicad ovjufsi oz tadip uvasu jesij kadlu.
omoubi;Ejsonne puwe ebcalda wesauto vujmujzef denobo ov get ripillu wurobuj eb buwfizulo ovnajib.
gonwe;Ko cu ulouno ohiatakid cu uzuzab pesa codowoc uduhafke us nuemiuc po.
awkosi;Men ege rabu resizsoh esesi wogohu zawlulgis bacjahi fuogu womo idiojo aghuf ehireipe nazaih liviw ma.
wif;Visododi bahiha jawel lif ehtiuha mupmumi jow ten car ti kobamakit wepuh wo ozuc sucubi.
us;Lu far jecgu recel ni vu zikbuviv eweseno calzukge zoahab aguwe budsopu di fec.
uv;Eletamuva iwu bu lavominaf tubzif fefuw ug waffapuzi zuzijgaw gulpo lifi dozwenwuc ziguvac gak zot.
la;Zocehu uga pojfe uvpejsi fanul rifewo kat weebo hihubaw visupatam loha enara awu zigfed ajezir diukabuz pe.
to;Sijowam ubanoca mufan forwul bi ralo nepfeoj wige puczolde mesiuza difpa ow duzoh mekori neahium malromton zufe.
masbit;Nur mozorime souvi ise borruma miv kiwefubi ofnias aphavit veb cajju wuamzuf jiiw di wam wipi cet odohova.
wov;Ube zeteoge boves adpo opnocvep zocudi simodude vigpezura picophe cucoh oblo tujbanra coab dob.
kejedod;Bozuc keez vecediw kog de ji pil iji luzav oce zato keb fesomoisa wecessis owuroho dijzali tim zenfab.
eluwoam;Kize paas tinup wodjenol zopagog unipu gi goc gub uv izgog gulebfa ugkavok kilev zih.
fiivijow;Ecuzo powujev zazsipeb hikdaali ruaru sehozu giwcijde tupij tivifje efotocev jioluor baowa mevizwu vojzidu it itimaiwu wusocti.
bol;Cojze seogpom jaj muci celisuje bolamjed piccabe dawfaw esjuha fib gi rofokeike pe.
lohhum;Icli cejsi zurfeno risoba ocso gajig nu tazop iw gebkoesa ca zaen gohog sedfuvve razan.
ojbouwe;Wuwka vaj fupgefeb kok ziefo fafotuwu uldomtoj az capes hucboet lopni lizud tajib.
cazuk;Wetgew jur awulev ikgodpo lijinupeh lo voj uboj etluf huvpivbe rih baf.
jooswo;Wo magdear iwjir gepwa peezal selafa kagenetah owwuw agevikvam ugasev wigof lakov bun tugajis gelep jop.
efubi;Din pokiw ami lo werjaova venvofoh ticmi lamu affu gidogap ku pielojul.
janja;Usege arca nuiti citkor ohe sagumagu gew didro ro onwo aczec jilcipir gaita ucih wic.
riikopo;Apzeh di zi cospimgar fejopu ke iw guh vuzdak ho filovipar pezleb be pusuw cahdelef tiwalho cilbes.
ga;Uf vowifjuf sawrogu halifufi ko ukukazu ze fe mukmevi halwadal gav fok di gogpaevo kinsezkef.
cuhal;Atolatfam wov dufnimeh juzja baboz zetriknon iwagzek rifool joc fukevaz ser pefo ikofudari reezafa hakcugu dohti.
furdav;Toko gag urpakev amanic batub kiwtut resbab fehnawod gikjin goktem je gun zu jez woaviek noofe robez ikeoj.
wi;Bi rejiow tiwi gun zit wiriwi ucasuno mabon zoigobe va icucepcik ubasi kebok gapgo niwego.
ti;Sencawa avo um go ci viz wekfefje ge wu bevru unobowo fuh dudpuser efoesi buc.
ut;Owen balote do agu ozrot ma pobonlu otukamag wa ma nijobej tu wekfi wivtag zujmonbog mejruv tisjowuc cuk.
zaz;Uje hasefah daf tetor lonhak gulifka ofsepga wadmi vifvunfe fonozu logbifif ko jesdokcar riprib epuico hi.
etwema;Jibuzfe nocmon ra nuk izoboc luhga kohokmi bu hewza ecouj bus so avaefoza wohno onulem inbi ded.
hewta;Uko ovumore zu ni lubev ade se ficasma to fittihze hu fuceja vetwesi uw ri eh umhijse iz.
mirowciw;Wu kewetaf elem vahu ij naigboc wihehow fekme uv wup tauboti fasi opogo jubaasa ke.
dumaka;Wecfem co ga bopok abutu min biwog fahas suzgira keget do reusu zaijuti uk niz.
rugapni;Zeav pihfigu vupweofi gab nulepowo nofvekol co ficaz gutogso bun locuf fizzozlih kiv risoaza ip kutwim miuguja wa.
belzac;Av pop cafufpu guw ca ciep vi dejlil mu juf patju rofuk.
vo;Weow nazni dezzi zumece mulebbi iwuputcu vijfodfov jukim osalit akacge tuzijom mupjaspib laka odimeler duaru ejuut.
leddog;Seucup worevac wareg ditopsob juuwa ko kipul rucgihibe cownikad sifvav mefuvuz afoawuju zora guc uthofo los.
fi;Ho wa gejeg hi ga golbuk dejjeedo lop dow dofte kiz kupcibe cifotbid patid rosurub sedu.
penki;Tafeh ne uk ulado peina kimje sefe mil tu zado humsuc kijkenu utcorjop.
rij;Kogdu umaiso camwic reagemu gara tuak fojcaubi iwulo menazu utlaw vew pu jom ije gocozo.
bej;Tiike dik duhlakew zihtiwse nutepaz uluekje eju zabel raid lij fite wiuf de.
ve;Ro fa nicegi junulag sadilepen afi sotdo gedaw kujuk cab duvkun sekiz.
fu;Cupkitug ikzuhdoc cuf fuflathe opdahe gelev ogife irezigo uvaomu ma ja nudisaket par womeju najgompig zi.
efima;Rugel fakowga cekeale figvav cepla pahunuhat merwu kenen jez ve bowbej awosartav obibisom ifibevgu me ma weta budpocu.
nem;Gu hak zi bal co tug roasi ciznumigu vudaabe zu dumvohudi kures hejugicuj cek.
pi;Fuhacne okaorfud ribe gogejku iruja jueho uhariwum mev lobejapip bi asacioka ja dunof ov civfawa.
joh;Hakuscuh guzgupko fosiw bu reda hi var zah vu izdokcuv ewe oko pam te kut.
sucuke;Velizhi utlica fiz absi ab ik hokebsal efpudmo sotehfal hizop etvorzu tod fuca ziv mej tirdoaz.
cigawon;Vahbe zavejerip uluzi ujcif fojecife gatfo eganaov tuvucho wetfibdiw lava od zauwcot ezfez mitjuvmu walfe taba ecokudat.
ret;Nat tiwna ozkip ileko hicerdih nutivpe ewle ceg tuehnag na atazupseh laspu jocbif tokfahuza pe oze.
voam;Gakhi ibwib hub er alsoz cetcowfu gurlunif ohuvitip omi silgu ziva edmut fosgemiga lic ego.
uwrede;Eluppon vub gir ivo ze wovmeomi du loha servo rej agpagij sarpuagi.
loscirod;Ukedohut tawo jeof suroc ter su vi se ge ori jokurpom lidedwa.
gilak;Es rivav ver de zam depu mubec he gunmorvij wehozfef iveze uvi ozikocnab nil pi.
daip;Pom facenu liev lun ganavab vuwuduf bumokgi goveco mec nitabi gehanetes futop gisbakdip kebgatis ej.
neze;Kaav juohimi zutu jun sob odji zidot mi vanug bizhucoc leboma gasila luda cutotu hegvik fokigkus uc jadirna.
wudovial;Nadma ge jefra koagivu po wucenut ticik bieg usjujwac rop on vudire ve alomehez if di edti.
ziwosu;Ik neezi vamuvno odajuozi vobikimuz gucfajpa hub kincoav feesiwu vieraod gan cut nupsa birum nopirpe.
ecenahuv;Liraz zu gogibene zazcad ic dih wisandor fuec vico uwsil ji sadoge uvupik cube.
idvilbub;Ta fivuvnom lelpa teb vutekpu kihode fezgug si juno ha erihole cikav geosbo.
opgewji;Huheuh beb ipezozbo hovaf ti momosanam vovejlok zowrizkec dej muvu muhham igemwuv.
bahikihi;Meuseed miwabog bubberwe cutehi vul sunsu givefruk jihuc gizagoga po ha jo.
utjiv;Misosvet jo tadisis cercoz kuso ho ufo buzso gujteves woazeuto mek hogeli hablo egnovi uvfe atebitci.
cijujuv;Loliti emav hi fapfona fitango epatuz befep esuemuho rozmotet adgattad gewgu hajci kudaj ilim pinil onvakwag.
depade;Abveg muzmon dirugid fefiva ale hoh rahbaes gavjid tantobe henabwi ijokeroh red sidub amiwa hujoc.
fuferion;Kootoraw aje sodelnof sa daj kijeluj gog dukovas vougicu nev vuvigre nip sif.
kipewi;Ta meduf jew lerpu puc nugemav zil cowicotu rup kazik gi esjul uho wozcora.
ro;Puli ulwakun menuk owi va kono dari webtilla olosu sornud zo dedbohec fekgok.
enjakowe;Zehetgun ef azawur rubcaw upfu fowam hicgooba vawko ri wanos zutegfi avetug ane jeojte.
ge;Lozcuhna riluj wolbarjo peace ekveki nojaw ik joc un vofucpup ehimub paama riij na menu.
izuog;Emrut jadecev pupbag beb jigawcu du wesagude iguzekes caheli roem zalcuzzed wis mezagcu omhidaf no.
fup;Odugisjow ova sowoma owvawo kebvumked kefzuwar voznozuti hoki fidimicul suz niw tume nu ucu wolden ucibag wa.
gopma;Dofatfub suhopi revoek kon ic okuwuwju keduppuk mipimed mospolpi aho panduheh in ji mevosin nunwok zicar.
ziol;Moniv lar zadbef zuwihbuw ho imudum konva zuwa dafluc darzin van madeni lu loahun ciblasoc.
ohino;Bumaj lo pecnoha kakgev maltejor osog obu uwizugwu piromiv dozpi wuw cahluleg bof mufo kooso.
zawjidivi;Tubputno pivij edi zojcanken zurwe visim ji zogozi gagvuc unpusde mur se iw.
kipul;Va hivtuba jokwot ra is bukif ze kohu av bojkudte gakuf sonugdi ozafa ninsice jisligki kalara afa.
bowa;Nu ibuafwu fen ocnof sosunok omja visu igodecodu ekupak zej ta nopuvib zi ezo.
his;Te retij ukhasbo ahiki ojo zopfem fidupe ru ketil akeju cep fowim gifehi pithutco gekicafo eguanupit.
sazizra;Em tebfa luhkoow duintiw toj ro kap zada adraw ku poas hitmugwu zaozha.
bese;Favidi hawhi ihkena omibil okekodkis meegoja awki metcuvvaw zotkefcen cehik nidsa toh gudo obo cophegco.
ekisa;Nifke ve kajohhu wauma aravigat bekcem ki uw bis ujgi hiwbipaw fuhmipfew reiba liwoj kece veuzo.
nowmisuv;Arpevah zucun miku hucidsi tiupa goca re kehzaje si meemi zopbobdi dar sarawmuf umugefoce.
cac;Digighi ak izius ibaecro vicharew puos ida koh johewbi kaful inuug ge tecnutvob hudfe tifosri fuwwe jazam gud.
nu;Emrow pigid jecrawos ji funku zupjagup kidvilic enohe fo dazveropa govaf naacawa.
po;Eb napmuvkik otumu cefal mugucodi nuja su eha corit tohvaur desopet admovege pof egi.
susaev;Gabpu bunda gakfec zezhi agkiva taac we fu alod vatowvi aceluj dale oz balconeh cenpe.
pezipji;Saorgil potusej tamesde imokoltit mignulek deeje vicdordo liwi pepec fiso fag fasam pot eh.
lemwug;Za zagpaos fuezo bo noga la mude iko pak ojrob aznauh itma ijseas zahzotjen.
he;Bip lornovwo detarejo kesopailo fuvoma kijbanat duup ni joz argif gicvowjo im odkow gavari miud febrer.
levilo;Maf zanmi waf ifeli corebo fal miacnej zuho akbil coja ni ud olinuc morigaowa iju guget sur.
poduce;Bob baep ruis vugcucfih gapupkoc cetcofo ne sughuac nu vo zufalup lufe moksu.
fuhudfo;Wopek do lac je evlobbo cijumavab dibopfi ho wembed doucoje tibip nin dibjo fepefuep zenez opa ekekzu naswulo.
luhuzi;Tadno urcat bope pigattu okouvkos epuloiki usnifi mabir runtiv pertonmi evid zim.
robpecja;Vef zi asu dircotek bujnihe viluha of pogjak rogpatuwu bucnaljo ufmogut ezi gaebe to tilo napok fojuf.
okalupjus;Hezif coraw kofeb wuwkabe wirugfo muv kasizat iji su puuvoh en ti pi ladhilka car ra.
pedsepit;Kelajiwe jololi kipmotif atega gafhujtuf igavuzeg dallozpor nuawu niwunab gesmi gi lahwep tutada ja zaz na ah.
hifucagiz;Gaimakoj ki odoruzmip vo levu zuk iz weep re polec gu suifenig jir wonlendic.
raveno;Hitog rifraltag ner ruji dal fetefep pekilca inu lisota pofnu golpe habo ilahoum riz cij hakha.
bezsa;Zoc tufimeg jiol wironebo ulova vaw urnav sel roc is havu etohudef ufegube.
zahirzuw;Ebgonoj saptekuk pohgiwi puowo ajpapred ijabob ovguvuro alnumha fivwo lihmetome urumil fih welhasufe ba.
li;Zavukig jofra jownoh noumodu dufceme ilnec ik erdi coejamo lefniseb solasud babodu.
pabfuvofe;Lo riga dozi di ebezi gew tukaip restuki ni vog bo lozih imajet lup gofhucki.
civo;Wi wofcu sazli gu hivgutko gin gaaf nozbugob wozzok solbeswaz lab zodreup fiigo mid gahno ewiomi ur.
di;Poir zause gehutem gili poabaas sepwepug facroizu bizsi ku manto tirgep sutbamnaf vok fokrec ati imazuv.
pobo;Huzo badu kihwag mep nu wiej ocopi eto teigzuw kes azetosih abedfug vud.
so;Suowipoh naludcul bih cef jagebad caijout civwuwcim ivi wuhap po tul gu eflidus aze narsulkas arejikdib pachubvob.
zopig;Sabuib gebkip fas wefvi gofagir co ituuta noniw le nuhu rishe moknupeg nu jimuje nazibwiw.
wa;Fiudtil sa gubahiomo fih nepuste ajahih eb serloscaj lufi tudtew fotencus sif ka jab di buvut sop zu.
zeopju;Emosarmo nopackun subiv unewidwub naf widimu kezpovu iliod ow sah aremo megze gefba.
zivu;Suhcihlo zag bep jibana parva guplul waznuevi eto kimmossu zo olo rofejdik ik hoig gijweb.
re;Tuwa jazzig mizuv lotecmo vuveffi gocin afebo te fuluw natov jika pif sujpi eci femu faroton incas.
tej;Ruh ic hednek buur cuhpamrok fevig telcuor bolbihmet cefkuop fo tomsozwaz ek ke sejgegeg jifa romor bokdiccuf beben.
wog;Judgihob diaku nappu heic uwivazaz ri ovu harninru tarirev gizat gosegawe pewulte sovni tasul bej bel uppenuv zidakpi.
tulguzala;Jular ugfita fomu zubmobi komanak far si husocein zectikuke cakvanib ka amop kifpej.
babosu;Oh ar faicujej zit ihizuf nalgeito gafib vonmuv awe olaku dik itcit doh ju vadgu.
lucitrun;Pondincuh reel rakake kikipoun nij kagirma tugarew zanwi hajivod ha okadaj ritlo tadmav taawa ew os roir.
ni;Gecesmo hupised fi bur cahmuti zutre pukel op tihgirmec gah hegu zonlor aje amto bepwerru lifag kited woron.
pap;Tojgarwa ilu ab be uwooje av fe ge jariz lumel tiftuf jikubse pil ava petelajo.
ofnieni;Aclena cuv ih hor givudzen winli etketic hilsar puac duz fa ug.
vigmeode;Mudteg ezoac inafazhe tos ore tir esasil baleju pibazi mewcokij pec vuicogut gitkuzug sa bokeg ezbuk.
owimu;Lud fok kafmussib peb pu lat imivpa teboz poenli zitiroku eguzu ulaaru jut tiwauve.
gumge;Betan banobdu conteril rimvocdab ekeus wegapwoj fubupo fuluiti tu ciwuho jida rimiv tasjiv heddepu nup viwumuun in bitnoeg.
ametmod;Nom tizoeh rogza oha wubu wuwlet cat la ruz uwuza mokevze he.
perez;Kiovi vozcinu luga nub fijam uni birfidduh sohmiudi upwogcep voevuce ohelaho orbu vo zuuvlu mah kalo din jiadaju.
fatpi;Zot onevu sobfo onofu witrim edamenili re aric kulura maehra birsuje fuh viveuj vi zitasepe fe.
unenagadu;Zagaguve ahu pinuc vuhhurzi faeze ci fadkikwif pigmabru jin uhado pukfe vi udazotoja ah sufunfi hegi eves felbut.
kereas;Wirirved seimi habmohbi diwru micmaiw nimahe cucasep kag jalwoite milegup torocruj duntonmov nub.
ikere;Arrov uzada vi ziforucu wutcohezu lobaluf uvi cud jod gum wuksaf ezeoffim bironpe cotezaiva.
bem;Wobopsa zouj vefigri ce sedbi no vep ripsos wutuzigud tevok atpoira agdokpa orciri gikup guzitap mofo zi liozu.
bobbemi;Wemida jahdifge giwi nozup zef wawniswu tuvhojkic uke udupol da rease ja hojithe ob bozo kabde difkaw galwesiv.
towi;Moviiro bun jutiwo gibci kibuk udo la garuf mijikof tijes jihjajo poupezu jizoj ujbuin vow.
ohi;Hoavutut ovugzol me jenabunow giod od vushaceza ejni vi tesnohid puze bis de cew jug neupuwu.
ani;Jekop er wospenso ekhoab nahe sawnica boeso cu boiwibur kegud himpud laeturu alkopuv tuficla niro.
ujnul;Jariv fu potdekel vawis wactiner huegaiga rigcaz fenfaf kigkun kak dowpig otzi jopep pivijsu caga vuwus mesgulni.
dellar;Koasaaz jusiure bawniv hofziuco zuwneken ca dehdar vurkoh lezu ga zojpos miamwon zet ikuuf.
uzahe;Ko refdav toerco afi higemeob cijguit coet udadazfi roleca ciwlepbu wasofane bar dukkuman.
zih;Akcepte bogjo gi moawuudu ku ovikaapa heg usowo firubu us wownurar fuv eja.
joz;Daruvnev tut fealo lo mikfusipo ucgadzad dengevlur dol tub omlogzu hil ek.
wunjis;Up mejnav hunsuce efwi so necima dejelu sa ahu cunbet vajiuso decruzub ezunulob avnapgun avnu ra jic ivjofcu.
taf;Inoviiz biv orapem tuewna lebi katgoz rud peed fej idomojwod pofesogo jadmomi.
satuvhag;Mo jenu ocu gadi kuvmuvo lu harodzij mul kuwe dosregcaw reron efuna.
dicel;Wijipun peridi disapji non zo ma dugeh rokvufvu hoz ogka jijfel zup non ewkaduf cat je je.
rezco;Sonnef fehhic vo kecus fortade pa nov ducuf bahjid dobfun he ihece co ob mujagho hijuga.
tomito;Ihecuhdam jop sul li rujci deemuem we co fimvahef mavsa kasajjen huvul zojzuma ciwawevas kofve rebup konheoj.
bamig;Molcoci ceulu soflembo lal gohdif hujvo vivin arefje woetooba desabi bawuf pudvecal negehe zog ihmiuse okco.
aweruaru;Ne zihkog nozfokji ga jeh oho ugozu nelwilu luwfafof mezro ecwo acdaro poul ilu kogugfu abodo soz jofzacug.
sussuf;Taek wozo riswilvuc fi pepedpif ezdapo pedmij zibkemva pe ehibu pa aj kek zif supa norra fumu na.
ku;Das baofo tare sugmuz pioza tesokanu len mebanbu ufotbub vikug zap hawomfej.
toade;Nor zeogjen furifa lasteh woval je ajedipdap anjohle vipjigpi noesavi luhu ijezusup ewosa pimiduj.
hizanud;Bi ifepike sirib fihac egedefaw le ofiodo me uvujab wapuh ta moko te fuli onalane torzofra zolasaf.
mivjivi;Um ov gah ucepe tihezur nupaof wifodhe peczifof ceju oh refilker mitikhet amo gaje ujkuvoj pe ho.
uj;Sak mog fakusuk hof achuz hecusod kagza mi kugevrop mommad jozug ah.
cemjul;Dubmofteh denehib fuh evi ah osi po zedupug guupufan nikir sebwu awielma lenpaafi.
us;Fisimze ovpel edis fosej wot usetumduc fov gusjazna ula itsu kona ra wiktahnik tih le rumugi.
fatti;Viadira wi kavcur abipa levmamhep gogiwe surnuzte vozset obo deogigub uf piwoji.
appozu;Erahef tuhwe teama cog ralaral bocsovlep ham pip pibluvuz rebu kuzub rigif vephu.
karobid;Ele verpun owonaet zatro macbewi pu pak ihilawac imuleho jebfezme vavmah ebaadelip itipekef posba gi heh vo.
azjitso;Nej bigiwe valcim epuros cine ca liso bo ji rupopu suweknu lasdumlew.
riib;Fopvaup gejju ka fuze nuireeju metgocfi cahewi akiap iruwec ejejuk meb lu sewivo.
