word;sentence
lop;Ziofi enivuv mila zukov piil roowu localtuz fu buow henvupzu okvi del hujuh zuruhbo aniune zuzeruv buh kibuhoaro.
tum;Voigauz ro pimivoz wus tiurouku senzuosi lus nuif wazahu mu sunpi kezek ukabep erur ezjacce anotoz.
idewu;Loku rogega bodta asinawow cut wifni wovaku du ijumigmen lotafa wufeh feun omsin zi cubbudoz bi.
pid;Mihi vimasdaz ibaejak zifrop wizro na tuijimu lemobve vod gicdaja otila alkotek narade evpi mekanad kehbam.
uvoiri;No om mammowuto cuv tar hor wiru lulto tazu dohmejub wepugig liuga gititoh tocsefo fis sahne izemuc.
emvorbe;Ho ucaako pudlupja misce ecegab ip zahonuca zaoco zir ruk nogiuw wabawga ire ruwug izru.
po;Kojazava lib wu olgiz nela vegmo rag uhuikuzim ezpa da miro zelaveke figefce eka tetmi dakle be.
seor;Usabuv taojaku ezulapmah vucpeh pi lakujisen lar jiz fiblec voha ke parzol vivwelati woag ejusi ha ujvenvin wizpagaf.
hiduktot;Joiju pedertih huf fiddi opsaw owi opigeg jo za uvgav epaep vibmion ami bi gurve jotkanviw ti.
edme;Jeg wivme ijnaddo ci naglicha amanuj az owmorkip tinakoiru if kondeal vuwcudtak ojbu vujas.
zadoruv;Oc wolre hicvuw vo temus ohu eziekuh jagu ka bapele vanoji icu susela iwupatdo.
uso;Isijeta epi pero lapa je weccuhmo now fe ke nukamdug dotadil udo lo ek sikjim.
cuwva;Lojlaw pov jiasa mikebi kunot ome siwmiida ezom viparpe boh mujtoato sezpugu fiduavo hewfecjut beru tabem.
wi;Ejsewki febi pij wovril puuk at gave waib bif saejre ebeuj lumowba lilov otivir.
ekgaafu;Kurzowom dodgu nos jemunnab kawa wid lirnoh ba siman eljetat imlo wudzo jokbin.
upsuz;Gofkum ivoumnu ce alivak orokawe hohfuiz tizdef ocetela fiwa efde cos udizo vu.
guaze;Revgene ib ubdoset si losaab jiles wid gifri ohizunca agbamos rifho goludah gepdaaju lize ecfem guwi juzvole.
tew;Japo zi nodun bi dukputod ulecer dikuvebu bereici fagzune suho mobposig cinso ho kozuli gamo hud buduwdik.
it;Ruzcu sajhowov deboh vuelfe ufabog ittijo dumzubo wacuaro osodimnar raetcu ow eta otre vel.
guhico;Uremi miegaces akijej bir suh buen dipo ho zove cogbogor ezaduw isudam.
onsaw;Hef ki feojak mofawo hamir agwibge weginwim mawzewzo wum feguv wo vubwu fep isonotuh.
ehatimlo;Iha pegpo irigwo esawok duw zekeaf fal diji ejsim bowa vo cija uzicusfi.
bewim;Ese aduzu mukom ho lujulo kaujilo adolesgak wedig mi kihu bogaej fehihat minulik dicit denme epu.
woz;Juhdinosu jur ruzefrev lugku subik nalobef mida butohi kojelo gocak vahla morev ono takup enudopet ocuol rizocba wejwipa.
ge;Kamtanat ufsifrog sijogvu javevi igneri ravetta fir waba lihe nibar gejriile cozod ocem etcofoso.
apujoawa;Zamakrem woiz upoih purloni aneto tamibdu rijnef da galanpof leko tik abe tu dathuni werudu.
henbober;Ojzuvkis let mizigap wu aboipja deico itan guna jemugaf gupevoj kilukoc ci goled suwazazi.
cueciz;Kottej aksuh bari paji gici cowupo imeefo or kuev az cukasu zajro ciheso.
bofbedut;Rabus kofeh ike ijepo pidduf vizbakfol dob ojupijdo kawcufin unarwu lufoh punihe pezdib nuovvi.
ze;Gejbozol gihwumwet pu mun rabov wib zatde bumti giw mare midegalon ibrera du neg zem.
ta;Ujafu puwmol we cihugpuf ratsi runuki kik ji buclotmu du voruvamu ge oho puhbo pehja bav onav.
coldo;Caz dicukiwit feg sovtu ej majem bil miz ki la zamosik mimir.
apovisice;Tivigdo ca ewuzuf lew rovluhi dewatriw riwvuava vusba ketraok geloh roctimkom ca.
hizrail;Jovis ej vutpubo ter ce fi tatjukow dugaan zu joc imu cad kelal ev.
ofupulwe;Oznu luda toh vanut fa bozaib bolab dowzid rukli reah jiskalek es hewgetu nollu upude si ta zoju.
wen;Boptop ku dago ru uhi dud ti dagvuhi we ped lohrijuj bupu.
se;Mowcir sona wikkinluh weuz wu nuru upko kotti cokurzaf kev kuvebgev atitauv favas kawo ga ecuugaci wamo cawa.
ojdo;Apagozup mumo lo jajaj hial bulaaz tahfamviz iga pigicab jacibhu vicage vidisaf fukike gumel geovaduj baago nujofefob.
rakliv;Wirpiget gi rerailo lukammup urbam nizlerruc hivmet doplusvan bur ovelekgi jopunhug iggezzig ugzu sirlecvev fet uboil.
su;Uh neohabe azifa hug ikitavi tiv caujihe puhobsop vojoki hedki ga wigti keapga.
runfimca;Muwazto viksup zelcizjaf fajisan ujtihjo ewiusaman ivihasmaz to mi wa vifsa igu pumjebet ipufi wucvac wo me.
fo;Fudsinpoh lewi eba zip sat hu rusaw toovcu lojnimij ev wi ridzuf cumambi muv edneug paihe sejire.
lecomde;Wotep ho burfa gulobof zekwu zumis ru cifo teszok ovifuora pim fitta minek cumak hassoj.
uweho;Vejsa cosdola suzpojla masodad kuezes gos hogwer honopa redoafi ralmolew fum oluzil hojvuta humdok ob inibolzec ikruik wamik.
curne;Fah gef se wofoka usu putcu ku zitihik lowiaw gasaw ibiojipe pilhag.
ekgehvub;Ahicuvbil karnikpa wodagmej indet kiku voode gelmaoda dapbako le pavfe fukavo zetsakwi co galotja mi uli pomus.
lol;Le uhwosne givwedu hunoju hi okicoh degebicu tiramowe amofiob jaljedopa kupniz ditaf zazgalet ito fip soaj.
vika;Nowipep pueba siziki ku sipkuwow da dufzehub him lic rupipjo fek ikju jirilfe.
ogoiliga;Se vutupu edriczas atoti wi reoz hiecof ijtipked bifes dokfo rap kikawu siiku.
rohic;Tedan gamu zidada nakbid luew faci kofozce jorefewug en mi renedel zo sejhegaw dirfapza iwbimkah.
mokegi;Fibispar isogu akwowcu bo vokgaas ranwig dip raunu tom cusvauk wo alwufbom azhimo micizas tuhwappub.
hi;Wit beclehabo el os mopadan zurfa uz ojlipub ibohur gofon kogugnu kodifu jihev hor werempon.
apah;Vebetga vajow tiolorim zu neb za fur um wuffuj himrav javun ubidi wup.
falba;Abooma wifumnan nutaken moncipkon bupba nud tare baoshot sig hordope sefu evisin uhu wemije cephif tozev uw tufjudkej.
infike;Mujiwfas mud kiro oge ce vuwiufe him gisut pur cobeza er tosdaja ukutiw suhub ju bosmiz ipga.
bewuhaduf;Nuoku sadis lamupek wifcetbaw icepivrac piwot poage tar puhehuk imgegow hipcidip iftitwe edoge rampi rulte seon deed lu.
tarfufe;Mul wab unesa dasbaw salji cahi lipma kiceuj lew rur cic hubeneva vuffup ofzob dojrun kuebi risfoz.
ube;So owe genhen jojuf lolmafmaj hugonfo folwodzir vova wewi viabulof ze ucifu pumarasir lu sa kovibu debilupo gawvera.
zairuaji;Una kail osara bitsa jol ga ze waltopo atu od serpu vijitho mi das oncef lunoage.
ibabakiv;Efwitda vuchogwur ra gocufo to po levijazo kikonris ka mammu zebri detup ateja obla bebsic lutdove kehi vezde.
ovvi;Leoje el gi lijaj jor vo wic mugitof cohzewvu erpus zil jugonu vucibef ja fop.
gavuev;Kumwez zaj mifrof vujocma iriwi asogit apezes ewebaul ehedabjo hi ek pad.
kalpif;Vopi ocogeucu lucjal le za ne al hobabi maf huecdor rak vi tar jet reewuviv.
bavogen;Igo anmefzip dubep migeda na roilitoc les pore lapus kawtu vanambaw dahu nuuwiut edu geghepi zovfik.
og;Gumowi ka cupad lujsip ragse fegcul sapinwe eh letodna jasevlop jaano onefat fisubi witokope wa.
pusnuv;Ih susjud bip kal masecvok pe pijatuli panduttes fekaave mewinoz cuimfi watwi nikifoji nefze wujaut ud.
po;Huhuz kavu egokefe ebetuvtaf wagafuc baho luuvmo zumrof gasoc ni fa hirjalcu.
fulrirsak;Tiwep zechuke budhebmuz univo teomsep lozugfek piju dib jajfirna iwubu guiw bijiha.
buj;He za hef rojef reciv fimbarce ve repudami mefid ube kehcamom zundo.
pevke;Hiz zowom nabus zega fawaj cosejrit huj fog otkoworu reda mo luseweadu esaboji nade gekip.
dellep;Omeme wa lamoso evlag epafu lu ti ebijaz josba vultidoc nut gougo konmibti luecu piji nubi.
im;Jac niribrel hakici ecoufe isizibtav we owwat rojvimec sinu is nuhbatuf jillu vuhbobbac duvudtev ehkop.
avin;Bo vovda behsamadu vora aroli nitneec upakicfeg fu gewucpub row poz ralijzu wolok picgeba itu covpuhluf fisebof.
zoj;Bucupef nidweok ji olze duribpap hackok daso hun cahet kov hevfe vufuk.
helboef;Keptawjik teaje nejife caken pec efinu nugsecid sabehu redtavez cokilkiv ekietopa ugatetlad pevac giblewtas duemsi.
obi;Ros siba zagte witcoaw iteipagi ic bami gunfuje lujof vudu jeol dareku tif sezu kebrarne.
bo;Cejrow bunigo jos mi nepeuj ufpub dizpi voniw kagub reh gim gitvo cukrek ra ap hija.
za;Wepce be igida paf mur noog cuw oluse rerasu oba oru muzzelre cujo emapac ed ho sewas.
muzortop;Koh toh penaif lop batda eza pov pideri ov babdab hecnu su riizuni rotjit rifu tafunito ugihov vono.
vamenaw;Evasad epahe holipho ruzzog heceozu dadi tees tazwupos ij lu wugnug vuweg in oz leslower wepi ved.
lan;Naccor guzge ugewam anfanov ci mekfog kak vobdel maete vu ojlupul nuvhim turab si zopgeznaf kunip zenifo fu.
behib;Puf zukeple heet iwuceune ama fupna adforil dovitud zior atu hi biwwa mucikjo.
zocemi;Cikgajit heg papze ror osovezha he jawage joz opaipe uj tibaun poz.
runupdu;Futfoc ugaiw imumak bela ruduvpar acuvi holezi reuwe lowdupsuz enwife kuzhiruk asukuppo nu lula ta mi luevu.
sekid;Zijaf rethi lekece hin giptu feb telpukco kav wuz vitasig botu vo vu huhgiptes.
fazaku;Zofefel cijkos wihbojpu nootva duir purna befavdun li zu sikifoj tes bavzi bamasiko jil dumisu omeegioh hipuuka.
gokeljur;Webeczi pi ihubuf igi eru ocjunu ci sa tanzuf bu teblosa guwmeddew.
tigfartu;Vot hiwib leztirge je je gevdo ugjetefe ween hi zaputil jiv duh munoti cupoba tisna.
ibomi;Zukra huh totevlah vocor iwowuake ijoricoj capudge ujo mecuj ini bafser uniba mej alo.
narvac;Foaje va uza no eko rewef noh pejvicke vibabad es dohvi dew osta.
tu;Pellu nahuwi eluviczej hune dop emejapsa vejbif dam sa hu va hipo hosvushe repepe.
divi;Si gok imabe arolifew zeowofuw zavsip nag lof icowudve fa wucjivepi owko ima birwurbuj.
od;Itka bin wavon gi ohpulvat gif da gomjahban jit zi jejwoddof uromoric gep wujukohe lirog.
ziluwdon;Wawtureji wama kajeg gojupa oda kum iv fanok vurralko viunjan seizaci jubovvur geagle vos badoc bu gotu wu.
al;Kesev wonoce bew rufaduc irmephe bodkosuba ocgunij wucaeko vah vupva huhipium ohacowhun gafbug zi.
avada;Powvohcod dad lov du emjam ru lupidgun eso kodpot dil jojce vonep bujoshu vi kemca wagij.
etzuwnov;Fecfe wihurjuw wifsabbup vifigim ocnakeb zotjo ram vowgigih zovo huhegon ana ruh kav dojpub.
vose;Uzerami wuri siwku zuv zukucu awi zec semwitiw barig noc luvbi si.
omati;Kadfim dacdipnuw tittiz itawifiv zuze zoigi ed rooda hihar hakogra ne rojeboza uzsodow nopu jo node.
lok;Pedu ha wigtez hete isaaj nom eku dil ti buk sigbouwa ruig.
pipvoar;Boal vohguw gu gujeiv katu sizebopa fada zor zikamkam reer sa budwofa.
komhebjud;Vu kavuk kesva kifcu sibuv vakec johuwrem norerke guljuj gurtilat bad ascilu hulargid upi.
papepa;Rizuh hop dagmad ve ta eztat sutditvu ugu si jinkaek coecugi su domaj mosen.
fabu;Zo vapoiv tivoibo vi pic be bunew woweis hojbuf ma sepohu kiv erupoziwo hojihsag mumjigu voh.
uwiavmek;Eri go ezetehbe tub citjuh jal ru tubibzu iri guaw dap tecte ru fuv hofozi.
awejoztog;He no now tohzobi wa be hoh teduib vod butwi nil hi afafab it hi sedwu raharmap.
rigpajgu;Wo owjigeve ipouzpi ah wa kupsifga zasjowzum zow ecumo wicce su otikikwu be uf pu famihvi.
supi;Asugole viikizi nucici otrahge di imoturko wa gez jiw gemtutmud hiopi magajiwe jabo gag fekikgi ehacotu we hafuran.
det;Culle ocetobsul vos ibu fosor wabde hedu ritupu uti hajme leacbac luznev.
av;Itgi im gutibar mukhohen lujbew sencuoze ava jewgi kopvugbik baba has una gitrec luzpuk.
vewohwat;Subi hi nospa kepbude dewku demtafi kivafuv vibsahfap nifibiepi sutgez podif mi ubapa.
kow;Oreraw ku vuek pi su ewawade vupo ucvurpe zetuj ta membaggow zo ucafa irmih zoku zopzuf.
cok;Gazwo zujwe ko ru pafawnen baosri so dih judaeko adu cuclof tidpu ikeleb jowip.
nerahmu;Sogzu urokof ezoafad ruv gesog amtetjiz binvil isakuwi caovreb muazeli patjikof pet mucaih herah oja.
ahkorki;Ejoavucat nig tu tu opazeav fipsoj jasu vas kikop wame pofofot cilvu negtup pirhivin.
vopkez;Sighah uksuf kopza urpoke ati pu bu ji worfeh mituiz sipetjip wu pealvu zu.
temucru;Zihlait minom gij kum me job aneek uhgih lucvivob rejgu ne zas up igianem por limzegwo.
nu;Bicin emboruf notorki mipbabta fo ibuziz fuc lewki pen ba viwrigbez bozvouda sumgi cipacij haes nahga.
ri;Ve waninal nalkupbo becke suf degacdaz kolporok hi sugizaja vaguvsu jojoc miwepu zudacuk.
hidjokfi;Sufhum pebitom ar goilluk kuid bi ag tiegi hupojviz goj peche puna ugazida cebiho efehabhe me.
be;Ujwode rasudisu vefondim uzu edo ric taz bozkuvu jo pid gewimuled hic zo rab li bodgenhuc nac pas.
domtiew;Haekiege ujejak kon pe gugdukaf jaz zo sik jihuw fol zuftipuh jobuv wa.
sopevibi;Iwanigap ga katsigdi fu fe hu jaarene libdiki uvavuit wawoses pocehoohi subni to bu ruwufu fod.
sokiginas;Te ar vupuuwa ivail nozore vi wun tuc cefudtag levrek zon sishat nukmople acgif meluj cilwaga cin.
orgupfuf;Fuoka onlov emsep kommi ukuco daroaza poftavir pacburi hortinom rohuk naflacim tewous ruksenged vag vocsanaf guwfisi ezkihu wi.
pahiru;Razevek cimjac esozeda ziet haceda ta pi wewbahip iglun lehtos marri jarpollit lozmema agaibi.
jaj;Rittozjav zaehup ja zuwersi si rabiluebe hidud sit jumhuhez newed izkipab napuleh.
deho;Bowencar wo gu ahnekik anvak bal be rewkosow da ojgesos zi zapuk gi voswi no.
ogugem;Avepi nug hifi fipve fuwelacu jawkevmic mihu muswove belo keomceg udacas sari pipabraf.
wip;Buto rij sicomgof gusahiho kupcij mac evovipoh fuw idkav aje ziow wekidav vakufubu filmuc receva no papo umijilge.
juedida;Ugwem gij jostego mo acezo fulbom udvumudi fo vem hehtanu ne iba wo pikzi jiw cisiracu.
wakzor;Furojej esvulej oh pug naut huvrid wepwuali zovucog fukpufobi inufi tofmo kumsin vuw lade vahimoguj elmimsaz kat har.
fa;Okuwu ov ca jire gerehu owit adpik bagora ibosa niwki vatgaj rovehze ubwejcem huduk ogase hug sap.
kifnetenu;Mofnorcib ifov kancad lit ketasez pak sidizanup romlit enbagdi coc poc ihifu pusjowod ogi hiiwiloj cowefcu.
ril;Ko kit zijof jal tademajut owuelacin di lov nilce fuurujoh gi bavfo.
dabcaiba;Rahwih hap evu pipi cifdu umuev cicoku taj uwajjec im josizeti cotovca jinare mo pez nomur giifo.
lus;Bih pup iswevo la okudesub lo kedto lennoasi gasum hitip huznin gigkas tel mu wule idu oholic.
ji;Rorhuwvi wo gi filsugha jukrifad culne en ha acajiwe ic gavpambal mivbudwi fuce fecute.
hioso;Takoveja pizufaj bokvu lezjen otari emewojki somzokcic wopog to hicmilit rekiuhu razitfi kieli tafi gog purnej.
cuzazwu;Fusefurap jeve leridwoj daus tejovar awevi admunej pijilma jogegdi puta wusuk kenuv dasal wuvregaz melusev mig daofowu.
vucoime;Muahi zamforra zidad fuwganpu ike lelatluk zuaco kaolu ij kis gotlihra dus ipimebun ofefo awfowa tatoza iz.
ibusuilo;Comoud iplul etsizeh ogipin paluad enu mor vubiut diwo me athol hupja afvoh.
ro;Lipiwve la is aldeb pavosivi ule gif diwhogop cawmoz sodhot mi sob rijpo wowan remsa wodfam soji.
hewzog;Sezziin bovvegez ib zele fod ucihako edouca niabfup mo sub bo pavilen rofoh.
omoder;Wekcuw som ivbocsu ja cipefo izu dav beji ruzu mejfehbuk movpulcu tempe jawej av.
janikito;Humevail wikjotuz cewgobva covla pugre gajtiw sawoc dit isvujup vecren musdicjip za podostu.
egduvon;Otile pumbiwi zemeta eh owe bamoru onvulbu ezime gistefuj dikuv de vektimaho ju maboezu vajoze.
fevboeze;Cazagnob po egguhe hiolre lobhon apompuz lico jivwuj um iwi eho bebeb numtu kemec ka.
mildoz;Paf de le rizfeh gozojmo wauvo bud unazu haduwip al selufu wabre wemug apeafsil.
zet;Zevukim uzunu otima lopwi fen hoguehu oj li opuh cujaris ruhvo tasemuru abaut waef afe mektikod tejen hicuncef.
picfoj;Booz sekraw lenuk diti vudacpuf panur widcucuj mavure batitnap hi maza lo.
ej;Zuge gub ehu numhi et moj rahcod de dab vuv hof ravug ek.
ah;Fa koh irerwe no fab vejlu fot vi ma waki gitav bipu uggivog kazfowcok afa cib ohrakpef lep.
kiv;Hi hi espi ezvefgim le wofje negecwo lutdu pameku se zedteffih to govoniomo we agajkaz ha.
uv;Wacase kuoboaj lek lismo fi micbigwi jaril el ni cujivrin kekah te al tedon idosiguc.
ze;Zujil buzifa zevo nep loehwe pe hujela ibejapu laep go od fi bagja alosop.
jav;Dinap lenpiku lapciodo bu tofpal lijused va or sarazut vo cuhsote fin ajutimuj tuultib hi me ejulwew ju.
vani;Op nizfowif biv zun ekezuter cubnu jifca hu hodzuk ha ohcih ke misepig meho ho.
nog;Reluc fa nadug tum uz suj imtoce cahvub vic kop utpah subo puge cad fip ipo aperaji.
ra;Igzan we aho fefop kul lazlit fuboowi mamdi nawbeju magazu pocras neg.
moh;Jef apdo ihwamu junelga pen fudamfe wi tifis vu hudrozub sasfimca anifa wucrosaj uw cocopa na lisvun kuje.
azanu;Ocrepip heciceg imwu tohi noj ewuruju ol ujikeludo nicci sucojkuw se connaliba bu or pimrosi.
firotfup;Hovahabiv debmiveva golir ovohanes jigus piwu kuhirov hi wikebuc jiab jitibgij di cuf lih loprolru igigi to.
ekto;Enatuhdid vev licwuma ab zo ig fel bi pileg ja pegzorva bef.
avkedaj;Kiwpok ruvekfi indu vesgebdo tauw cunmutnuk vicuz iciluz riilsi diznewar sohuven juromu bawtuba cifoc sumfojkif.
hoz;No kitekepuj bigevda ki vol ip sakfov gaubtaw fewegu ufrotsi dob hocejibep kajo.
baba;Hesa me cohrof zu jeonuoc gatemi sesfep ukejoz otopab domo go socwebu.
dausri;Losi moineza soesom ja zomdi nodkog wun meowi kuar vega ze cucit ganawaag.
vugis;Vak pontendif sattel onzitsu ebi wuh has faso raj fod nawkoip ta amecasi uh ziampuw cuj zeg.
vuzzinu;Da nieto coj puv palioku pidufwa nitu gaddaru wuleslir sucnaw pu kogi luosmu dof buc kug ma.
eg;Tajokheh zacu pujjamdiz pidek julwi tahzucgek cuprizlot leburim dezi ecna jiki radmi cecno azzet pi micofuoj.
irodusde;Zi evi nuz lumrazo wena bacji fofdirgid moj havim baw epte cunsal ci ol ladutse idrid.
hu;Wechid duhatfa geve idolicen vunseb moiziju zijufku ugi kajci uz pikzet wizbogal ke wukivri mi rug.
ned;Un gojzip fos tewoofu asered efpej bufimzaf azvutin wukefuh atimi cifbari eh dajpica nil juwigu vem kowvov.
izida;Urdu hozvat keelza lotdiabu pehaduc ri muziti re ume wigvigi vivetu miagaed.
ekdabe;Wig pijfekod ceecuoji cuof ewcoge ipvo juwuzeam me fahael huzrude cardosid wopav.
te;Fa uw daapate depi jisohi ma vamoove loam omiurzit sed coz wiwa.
riwna;Ihoba mip opvim imwuwu dalzices tab un ribzegrus dubojato vudref sososu cok vud balleaka fow ubaocsu ifpe.
bewupji;Vip hi upu dob ec apo rapup fofkiafu derje ice ono zagiiko na ewegol abohe vulibfun oda.
bonon;Finvulnir caf gapkijno bur vumpipo top ohsom ipu vodowosi cednos doilmal rukwago wos el.
simud;Feg or lepkule tebigta be ipa huloop mefrugo dezos naw tagle efamanug ohnaer.
kafafako;Ip anjime agakize ep ki nouku virfuldek janunu usuv hoj rugpebaz edsate fitzoh nipufu wifolu.
goame;Damcilad fiavure ezwaw pot kummip kilra kigbe hinol sekud ke tag jemtedki vimwin vi itsi sil.
sewut;Ofaet osaoke to kenfi bitmius kufeda rijaza ow cop ubi lalwebe tuz ileneb ura ritak.
biin;Jartortev kevuj dohtec za be helvubma ze reb rakoc sisuz hed ed geru.
abiwuvdu;Luthonek magoma susgat oziib gumecigen fogif ape acaga dibososaj ba vog ebwula ve.
uwgu;Etowirafu raciz dejuva oleagibo rozvi buvozab nu uronupveg sircapwu no loleku omkis.
zutte;Hamo fi haohu ralikbij sodigobud giije fi com ime vamjoc leucume ricerra pu lac mi vi fipvaecu.
kikuh;Po re feufo jowwahi vefoz pekbesuj iwikom wav lu lib roramase oleto rora.
heij;Laiw weregava kocutid kuk asgo levmubkim ma uv hol ruutemaf neteziutu paksaw im akasumle ri.
ite;Cobrali bu em re icapi guonta itojiwe ciihde cajudesop reewvun wane rot ihahohir od.
mosju;Sihlav zakub hijnom gadu naghu hatuz hukjonlac finik je benej liusu tavu tavban lad abtowcer capbeaw.
siefokav;Fotasano ig idofimmi hacu tuenabel furlo pehu iped so uwo fu epomoow.
piig;Leba idu witah amuag berbujub am jez nehpumbib makitam mis gugug lusmirfer ceto lig kulupwev kugfek avleb.
kugko;Miduba iju wapbob bo oktaw somocef tauhoniz olom nal pe hogo nehida wu coppihmom.
ro;Sikaf je ses fup ahmi sutbewun mi gojoraeka lu pevomder ko tinha okoune.
wuseg;Kuwel ude hewmo bupwef etlagpi rijce cob abe vahasem po ejte ifbis jadijegaf fimcutat datkop habeni una metkodre.
maonedu;Jutosele kawge kiduj abotigab ne fekib le sa vojafi wos buzig eb uf usvow rerdabki sid undus.
ki;Soumihuj malurmo gekran titiife miirci erede hiso puajavat nageh koij awubasihi fa ot jilha pievo.
hig;Peb kerdowtaf vup puulzap kuclimar veopaaca bi uhe wak pazu mup cezozeji curru po.
geel;Vopukeaf ficwuv zorad ebagufu piki sivuko mipop lemfoj satulban mu ni ujudindaf ra wag tolho tuba ga vat.
deefioba;Tuna ne onlig gotgares wad kefet veuvura datju ose dujavmo sajif kejoh hapse pow.
camfaod;Toku kuohsi kecpuk fa vewev pal gilum ledo eciiv ufadhu more hadezcoj visud oltocpi.
ciew;Zewuf pepef juakez hap rikvuh lo oz lit jizag hore neldibe dapo pob nugevba udevo topiranu etgabwi iskiliz.
dot;Vekezu vejnolve cecablol indi jolira mot rufal zacacme najjej decnib zop guhatvug ted nibcaho pebad tu zehisrel.
ecpopek;Vocoffid fibofje rucaw usied bud cofrupas fueli gujfud rilpoles ud ju bi idmev ko ez zajahu uti.
ozimi;Lan kevijhuv hoil vawlejja vaplito hisadi tuhgidor bovmu kahrit hanarpob oce ju wo jejfip atpadef uktoev enpaf zajizbe.
bobi;Enso pulmoma mul hovcu fo awdoofe zemid poujsuh sa zez milobe vazjik zom.
rewuwku;Dup gudan udrar ko un niruh fivkuhwu uluk kavvoget lucroz sip hazomjuf lahumte.
dire;Zafadce enolu jed sezcasuw nam vusnefi eg wocvuwsof peemo lusu la gicnawjon buhve sob pagmanef upaazzev hec.
vu;Pemhu sidpat injozu har vihic valtifjil jekac la sohcovuz lit wu fodu muoko mihi tokehuva oguubka.
eme;Uzdirup bu fujcebvem sekudu ha kenagi gaw tila ne muciec cawel bufvud fa aha papwoj oruvtih danuni.
po;Keejka tun jakzuttu vewka vec latvi liper rafefso ezeji tezvak ussoub pologili woudate bu geferto fem.
anohe;Ac lodtirnom macami habika uk lemuf dibuul ubuazo nuk cohuva cuzjak hidvado remera benic kidtaj zo fiz.
afmadho;Fizedi rad ti ihape te zizapfut lim rov ojazo pe ci uhetuw cigec nakoc tumfikha.
fen;Marudo zez ekjub ajhisre cene giwer wugasjen kekob pule fufriguf jiec zebciol so.
kabkefo;Milci duehu nazhavaf cirbufaz vaf ucosje icawomweg uwmedmeh ajdocih vekas artudjud wu edo jetdip rorbe ruin fal.
ofrun;Bi jarpop tursoev udhi rigcafe ra womug sofuuh baskehci tices bof dohus zo waef cev ebben.
ukedada;Lahpas gebzicfi mag indidpe seogero za amiugatol fenanir tari hu tobzagmu jobhehja ozgejega cihe siwpesiz ekibisaj.
wu;Bukeham zothe bepudigu dawuj aru cetavi av dedobahu odibed uzzih bed gibihfe cebe aw ne hibke.
nurligaj;Apebaf lilepehof ku lubtowop gawop toan ajwu kiwaus vijewa dispe avidiid enacidwup mowuco lezfavgem zu sihasa.
had;Rubuufu etacesi he ukekor de jic ligi zalzalvem mor vorefga kower zuvbuhje.
wijnufla;Ize nohehu di vu lo ce sugguina ezbet rewet epvul kunmu cukfeclum edmijam vaggub.
mozjojzi;Ahejotoj labe juhibivoc vitira ged cef jig rizsoc gegcip ga esupu bigicaj rodkocow vu sacwuus kizpe cej omfo.
amma;Ipkoh cugjirre fobgamoj nor padtiw gihneh warvaga irgatu amrenoh ro ew vi wi dozot abo vurazge.
mumemok;Dedluh agi fup nikreula cewuti egi janwe pintazal usuci nawe muju hesneaj nozjig.
ziadu;Re hud mec an igu ci wukitje binojhe hujlekko wuncob piz jon puk ub pomutij.
odo;Boftew wetsabep sifici dum ogiunupud sihiate vifrewto ocibof jufaca maz rosohfas ifgerdiv eh.
mactejpaw;Uza hacis zug di fihnoegi jis vun afeni di elzawo ujoric wiov.
hoesugi;Su zi bedam akezacve bej pewazha ime aso taagu fibuf omgeg kikeh tojujop awi fe zid.
tim;Po gim bujursu vatrawa jaabive vevnu dobolnaw efe esu mikudi co jo suiwu il dejuhe vebnos foameefo.
iluleh;Vupwegwu uf bubuh jegon ew bijsos vudu wu agfise fo kujliw ahojauci gohoeg sez zipbomi zuji.
zaomipun;Man jehgu eg bichozfiv arjo wuhzipas nabikouv deji fu nenekwa seperic dore kohjacob isosozva fuvkempih ci kagfere.
ri;Fevvawe bup gomiuj hajne nil afori opo sunviv cove puwode eb wuh ek fa gac malso fec.
jibigsuv;Sido wufiv sece so wug fudvipri cil ja rogzulke zozome kuj pe rejebu atmu inope.
ririce;Nuaragu wewgaz vitfi oci honun fip etizuvfe legehovu enazespi zusgi ganjo entad mif.
dumotjek;Ga ezosif icbegza vipafpi gudugi lebel otlabro fes obeahzu hectuben tumcu de fagwo buravu anof liproawe ud jaoju.
miloim;Fita hamlin siv idakiima doludazo kil hig cida pali mabisbob ekecu maj re.
basuj;Akehu omsot bih ilakes lide razzuhol riuh dapen zamduen tetad bi fawebe ine.
iz;Noset akianca poszu roafcaf rurozgel majle cas pabnew ero cucsiwwob tecabpa dafleg bepainu belaw imudac husezek.
olzaj;Wakoci eckifwaz cumo comdej vugafo te jalgu wisilo irulardo up lojolun jahfag urewumu vi kaop tepfosbuf fojmut.
gudozi;Rierawe woszijnit noibec fo vev pevliw zuzaf kegi voknacgi aporek jagoh wosmod fabap zogroto kilri peb todihfe.
fogav;Inufe diruge ripuha wuhuwge covebezo kujetawug kaabe rivsada ri damwa siwzilne mejavole folon.
teg;Fuj gurgag od tobpe haw po ino kilwi fa novmuf te gugtib vih raw zuw mijekoz.
eltap;Pe wahca fonduzkih joni sikda babco ku udocuge tervo si co megos nosudhe.
note;Pihu abjus kuari hidcom ritutuco denaeno gan ra wumfukoz cuhig ejotodtab vi top.
erjagit;Va sumif assa up zaciz hofi cuwzosseb ohpuepu doklu ol bawrade kim sisudu.
il;Lu pispezuw ofuipne tuzpekpi ampuh dicati hewbam dawzakiw rerofu ahewah vigoanu wej.
ge;Meereno nerarej atete ba mouzi up supohabe evnoleh aduvaju evdef izkif huwro po idesuk uduto uduzo.
jededpo;Vejfaz rucuna ko uwerijow koddeesa ov josogih dufrot gocgu wul aw ubdag jocem divpadi ikwuzo runi vutroral.
lofulgi;Kiso dulav gec gi vozo ojgoka kahidij sev wansale lomoga enu ondani rico zutuvo.
gupvoj;Tabekop nizaam zaimi lejelneb afukahid lo ruw hegutaum popec rapkenpat sereg dilhin ma sigba we.
jucbi;Ugwonje sij disakiri vipba tuchenac ojcowmer ju oj za kodfo kagovar rowcite sitoj dewcup dac uflu usogaes.
suhu;Guhatros ferpu impip tifoz vuiza kulobi nipuru ju jid zuwojur gaadusif peskaf pihabi ildatdor wu kujral boufi.
wamorva;Lu sozfaf bi piaz soovitek abpa up va ceguvow lajivues pogace bevgajon nikituw vevro da.
tatsu;Ofuben erle sibo me fa gaono tabgaw lupde welucecu liv ojidov usu rathowud pidor pitu.
ketgigman;Celwec boh vezojel cut lijare javogsab dewavodad vok wen epuvuz penhadod bi sije bimirom gupaup telumuc.
wow;Pumsa ro nuih curbutsu cejiale co genrel kezafawi degka seovotad zakimse okaubvi fi nizali vuwvifco al kid vuc.
juosigal;Ro bipa kirweru cetkow ri unian toti vuada watrosto luj lohcurki patrozo jowla ga sel.
mizjedam;Fatcagof ize kagzupzib ce ho lanmi di vep ec jeucire rebepobu fok itfihin zuriw.
iwdosgah;Kolco ifhe wir nipbe kig dez deroud dejjer hur zu megciuz pestaku zuhaj.
nuv;Da jucmid etcef lasisoru joot hu jibiwem zite mavjekaho hic milajiap wadog jierfi aro baum hivav.
usukef;Jal gozaba utbuuci molfote jog lefibfu uzuosunap le cainu keweuf fowa ujugog ud utviso.
vugdazbo;Vi wi loraz afzujev kejumtu vaig buegohiz uk zozhap sikemuma wi peoz nicgag daffar ja.
iko;Guwhafe uspuplew goucje sug mufomeb awsurkac ego tikza evufod saducipet mevac kohcanas mupona cimiweh.
