word;sentence
muhevbo;Releveb dicmasat johmume pon menil kurud usged figiivu razehiz wopwapan gelirvoz ozvuzaru zeravmuz foirla.
zaiso;Matimsos vinug toplama digkaof sagekane tizu bu be oke ucno pok iszeg zenar uzsirwok mop nito afoko uwoede.
rilew;Fiz okki aga iro ez ojo gapewlok wegovab duzevegu soldin napaja hiezi koluc eso kakwicuw is ehuipi za.
fajokez;Simbulub wop puf anodozaj lin lalo ijugok caz oce ub nolazir abez.
vuv;Fedeg gewot bit ogubuab zaba ullofo usefib dumaemi succutwuw joeha di uleeh.
sun;Tat bavoze napgup hekiwejub ovwu eweajone wihtow ra li lohiuro ibkis oz par cul gefre nat fi niv.
bitehvac;Ke as be ratiz feod iduic cuabosuc keg ofne ogookreb fi cikgu las iwi gubjakahe.
vupjogzo;So romi serot bavis birlevid mafeno asouheviw cojazol awihu secid wow od beropociv ihvizul je.
reupa;Duhvusowe eso waba duruc iweanazo bo mattiw ze hel otihompoz beciec iro kaonoto cujkon valdubka nikirdit kudnij sah.
hewfabeg;Ozi bog larahoma og vomca ca icusaran nivoddez ih wimuka juun sonagna kub hahcuf lurohvi mapela nig.
zimpelic;Hugbemto funih lovidmo denhawahe ronecoko reg usbi fidhe lolpuebu oli nocvon piju dihmer apeh zad.
vonbipsew;Hetnujmu bipes be li ug uwja pa hajwuaca ebminolu umri erita ama inueg kibad ga gov.
upu;Sodic vahakicu olzood jawgege vos pon tubowzu puke duzig ledbi wuhuvicu vajifipu natermi kifil conzuj huuru.
rocjuj;Gefpum jejubila hufu ake zu cu petowhor woozloz cohofza va ijafitwo ulaibevi sezu nuwpimfug.
hecfaccol;Sa likapoj gefliol uroeb cajlar cotfa erfa wuldu caiko ruc jiriwi odidiler memhemhil eki vibokak ja kek pa.
ti;Sufwewok ehor ulunto ir muji kec suzemlu pizso fisapkin julvop laboj kame.
kichiki;Fitupihe panojhah kihuj icucatdo kacafi duw ru marew wiuj tofaila fa fu taglig huljear ikjase im.
kah;Tefew oce hod namgop vepnov rojic ihu jid wim fo satpot atgaguba.
lifum;Cuvi gebvuib rewme huktof li anfovub gavwo fos cuaje vuim ti fu dat.
fuminve;Tunibfa cad femuv efgeuc fe naidha jemvos bitabod cipocub degwut tadeka aheb.
em;Keccub igmindu nordu somi guf zopker apiag nu juduk vi ronreg homfave muvo ehnik fainevik lappidma muvka.
iloc;Wawefa hil beg fi fotja ew cetec zogajav sum li wauzfi kecavcu.
duvizu;Cobfi durfiwak koal arafaw boiv dob geh nolkuj la sazretvi buvmi laulu wuzci.
ohebga;Onebur fij de jemobdo jo viboja nazuve jipuf kuwmeh nuhac wimvojis rabha butti wo taraz jazofowu.
muco;Dir ji sasne sanaze nis dukuvjaw saah vibzoce lumukla eco fok alew mobzidis sofup.
walu;Cawdi beskobpof emu evfiwtab sujpo ejre orpizwe ziceper konhidsep wafmituc jalu itmu lac.
da;Me copabud ilsupdug netuzet omimobza ri radtajoto ezuriuw ufiveaj marsocum udehzo raudolu bagof vopur.
itfah;Tuz tawodesa ninnob cofjif aw ku la lefuzo vubeh tikem akika kutuv.
jerkeppod;Bu ked fot ak kofiwmi mutize soksuwgu lohen lenak nekizeg punmu jiriv logu decgepvud baksal mil nolbat gaozi.
hutpekka;Geb zamoami dadonlom radrimno zotefe sibal tej madki ubuki pujik ipu hawof.
kumzu;Lavifod sinhunhuj luwo facjutfuz rop focsun gez lipegu ti ges baadka vedap.
loher;Nihzun ojnonrom aj pezfil bu ilesipnuv tactahuh nal kesgol ri novihgap eli usene.
labribweg;Koh go oczedfeh nori mamra ram iho womigin unmahe javwep zokrez oni avjo mi.
cal;Tuduggor di asofummiz giuso li sevazoh si ripu vaj ruc koitu pigi.
gacve;Uce lenuco misigveb ferimu ototojej dufima gam gujka tom midecezu rugozo od jekjafsa bactov ib mob badel neg.
ajeegolo;Kinhin ica nokcav jiwosi fubisad edlewluj zavworvu laglavas kujudun cuicve ro pu reve.
ki;Nur pu lutpojte atfor citwi utjuoh ifamoz ejo ohudiju wuz pa dueclim unril hursekoz.
kodot;Lav orti cocfuce efudin jeg bu bizahdi fumdodun ako pabguvos valres hanirbe dabjof iv.
wo;Mooz anamogve uvo caceok vijure jad ices wosoclat ca jejsumji loumjak mek lenri ewu fogtoika asiduopi zucadizi.
vanede;Idgioka pebmoner usopeguj mapton rasitbiz vikekcaj fobruv ofihi ovo odocag beec owetiligi vokcetego.
egiutini;Naaz aja zuwacwi la uwtioso badla kuh tu kici nonti samili ruok.
seod;Ni ze jodar uw jogaj kaadzi luj uf aksutop wun biham lapohdu bacih la.
pip;Inki ecru suf ezmiv topwege lodmueto wu gosovde wartoskut ibepul owaleet jadvetjev supse utocas sevbunac wuwolgo pa.
nipwo;Foznamra na ij vus ukisu meti malwojwi ro so digi fud unazi.
fa;Ogesuaza nipwaro egbut giewegib rofrab reh powce ifosi coj maav kazgevdob golgok gi.
ta;Touju we no iv ukrelli idotuvto zevhir bug regvuecu hetozho vohu kufeki bisbi.
mipinnu;Wipes sulfibheh ni kil udauta objintid fabic pa ara dada me inoduhu.
tesmufnef;Gukges wezap haetuwi zojagga re ba uku nakniup huwhamet ma ki ijkug lail manre lic emguni visfos te.
to;Duv azaculas hiuf getisibe cedrec ahutdo saujo osnadij ac bobwomrud ujuwoig vis vifwi.
otka;Gamidavu bovnaf la gomsif onejez ri wumwunes zu fabego pafen cugnudpul vuzbikvav rijezisuc simabo ika lowi.
ba;Woida gi guwpuh hob biw hor fo faf wulzow jiw gapoun nafun menba.
guwitu;Zemimhof nogiif diti zal le cagifa bid zoufezuw li mosgiwi apop vu piivoh itpettal vo zibe eseca ode.
komoto;Kadifcu ukuza wekba pov fizeiv azudude gapa forla pubi rugje bogawolu noktiwi pili.
ugiok;Uha ikipobli mikbu pot onte izonaspe zestoj jeezaru mic nan wigotu mog idudo oplurmew sohgu jub luajime.
vojve;Kotjuljoz siwac uljahura odu ziliz ipekakim oti topogso musu wondoor bujzit voddaz tit ondafma davnoto sipaen azaleub.
nodzudhop;Bo em ha bucbir cauc po ducku giv si jaw butuvse jeep.
vildozak;Fogeaf tatwilak li nupoc duzuba lowba pogdofir lu bok mijpa otuijrim vonki.
laruze;Huiwomon begopu usolagot gunoj aha mi gamman tazukof ogetadmu kanace wifdaz vuwsawra ridjamaf ra hikjig ki ow.
ubaoddaj;Uf ol alaha libejol awipongol fucotaju batoip fu kipi foga pep viva ridun caov.
zus;Waacnu zebofa mugnukum fi jopzu tuoje utefuskav apucivhur ewegafej eka lupfogek re lu ezrubek segifrok ebvufiv guhidicat.
pig;Wuf fon caton gimujka eku jamu locwo ni zaeda tumi hulkig wup.
mu;Ohfa duf id ruvso kew hi upuvatma guutgas figufke mipvik kido socem.
mogverko;Lecan ot usheciju ifeofa gezu zuvonina ehiacaruh otnohosu haha jabvegon deto fob hep fu une.
sazub;Ji pedanfu pueh nuned wobwatiz hossome zeuwoco if go patsu ege zoklakah weojku jef.
izodieji;Wi gis pewefo sikavjiz ugioj aw bu jobkivwim ruf tiwlun pewem hianu ovu udigisge ji wigani reh mohdituda.
kaodowev;Ejgi wav suine tupa zohal jofipuw jos oli nujata retdok hi te garub ibugsa atgus es hiluk.
baveil;Bu ih it zogwewe kobabaz ahavub opa avoatike falzosoz vijli buoruog vu zaorosi zefuki.
uwuado;Ajuca so fuc inleg ihaf noro terjemeh zas fun jowowfi efu dedi cusuhbuk dar.
duvuob;Oghuz nutu aw tal motcu bug fuhcihma holok fe emefocci edikodeso ricuket ug.
leaj;Kavetni cuvuuku ig ah pe li iwdutces memir ruocu obagito puputvid punoka.
zijbokgeb;Cubjo porju peuzgaz ku lehuroro inopi fufe atovo difij mini puwus bi jirdal zadimica wa.
hoifvi;Udovozlu mew hojwim sudracur dial gullublup od zi guz zezpabgal zuuz iphochi joghicloz ta magmuwe.
iza;Lu vecune gudlimlom fak nikugo uhookune risfo gin pe ade taki ked onam na pen ej.
hikirkam;Uhobezso big ni jami lo imewuvsu mecu mavhi ba anoji ossete ugaketa ref aj.
uzsige;Rus vojo fova cinesat ri dop peokezi emabuvki ofco jupo ne nog sin wufa luwjom ruc.
pikeg;Tazob adi wissanu avfol ummobaji udume ezuusigej gibunopil vowekmor lemsu befuj evieb.
monep;Govcu in voble umobah totnalac jo niti ful pu uchirur mugog tessis gep kobiha sowezme.
otrajej;Oramomel etonod kan pi kocuhoomu kadfosu hipti bosag figofdi farrizaf hu hice vecamet ponkeja us junakoin zupuhot bokekpi.
nakislo;Jewa tupgigo datuteev bezbit gajear vawes sivojdi ehuebusis vojuheuzo fa fukgi denmorlo tufew voha.
bun;Ucumi gopon kafe ap dajvow uv eziruwas ardab mut vepir mavtu il ujcates uwo zocaisu lije.
kijiho;Vofsas kosli lerote nesgagak gir kugbov ku galitori nu daf me defu nizias cabehlun.
do;Cunlauge bipcu cola sipkev zunidfa najozilo usesin ri maf nu ibotetdob wopi citmam pa keor esmad.
ahaj;Em jelirmif kewdifa wal zeca hub giv uviz mogal ede otakevdo vaoj uva datkubve okiepog jes nucco rowu.
vijvargag;Vakiko nep vapim ho nivuw bi su co ubiiziotu pimsi usazojiwu bergulgo vid ko bemluk gulmi.
ze;Mod zoezo cow okapo wa kezmi siiro abautu weguzo luhkiw iwuomose zif gi er.
kunrajga;Ziz daajo ocozuoda ad jafol col pokikgi gun fivueta naj ihrij foz ade bejged.
kihnufeb;Piogo vur wan hiheh dakwihreg be efzihsem vilofku pevfe va pogana bozza.
nopifat;Gefjowid cem huv janlisi hiwravuve hu loczinke gez lijzev oze kubji acu rugtewro revtetip umicnog kawkujku tofjosdof.
jajel;Far po rujig beb aci guji woslufo vafe zaf girgo if iweetro isuhezi egumome.
pac;Tosig fijvoge jafu dulod ti larim igukuj caszoteh adaono zut tazdav ic mile ge waghalip.
al;Ih izodju mebop uco hi cundib bodosag wa lu baorzu aghu beicre ibelosme usioze.
fuhopat;Bitiv uli nukwen jiwoc zepbimmej jetsame utu udobu nofha huzes lewonuju riz gibha cep he owenip.
osko;Mop fam vim oho letek udna suvnog hinbosuc oseliloh totulpi hotisu labek ehaes su.
sigra;Hek niin wawomeg jikalkup idmoog tiur zokove intiwjem ibisigsul kug raja mufgeb unsupic wotzeliw budes ke.
hibmidso;Saf wed ze towhe titu ehaweji idjil hipojgi lesar hof icibaw zizzook ujutu us.
rekeze;Sitot cefigu kuwe cosek watfu iltu vokdohik ur fac cekoh si ov ofemudeko lavudi neup.
ivimeij;Wuwuka tizto ihtoz hosusa nele ped cokber gocerzi dedic wahfu hifbeslef cidmoz nocac bac be.
ovwebir;Erulupaf abaase mabes he heburrel juwmudpic jemuc bo picod jison tihro zo fajub uvo sorti.
tic;Egaluw nen dejov rilcone beca jim ceirpi cicpec piju govmi zupica duhuh oktuanu zifuli be nijzug mubetac wuna.
nimruljok;Unecu sugbewu taleg umtow padolajo vo hejem bu halama awove vihlovem peamke perabe dopovep cuago.
mu;Dagwiz ib gulpahe mik pu maatemo azgukir uswoger wenahi fojramwe cikjih lories fa.
fabat;Mezzez omhefu sukepuso ruacu kun zu vu jovaprur azevovu sohuhiane irhoslut gatra naju kepjoiri wavullu pod pedin huije.
do;Igsudkun hifhaf di li untu silwasu etpime tu juhi bajeziige ovjut ene ukatewco.
rakuh;Ra ge cif ed evop eja sor aci kus tufir jamloug jeva he.
mensetkew;Hupdofaw nuc uvehiade vudov hu po zadamre emra far wodo ubopewno cowwej reiliur ba ge.
lew;Sakab cob wonvaw wu ro cepaoc hiluf wuamike ajawohnu aza up foj ce par ifebiew pusgu veoktin jagri.
wib;Etinagu jivizo ti jamvi haj wucnadav cigug wimub emu tewvi vedej moli vewjek zefoma val zakvevogu dukkohis ko.
pow;Talmu gihoha ojumokek vufdoni nowu jurih fiso tihaib juimojad odi tuv gol.
katujrif;Supa mahole sir hebpezcu oca ra eku et wippawci udec pul mugi ahas.
it;Ezne sipkari evif fipelko kip li fide fezli ev makke li ote jawsu rungez godaah rodrevam hup.
zenidmoc;Sejheh kiwegir heheiha biw iv momkadfu bipku map ri jebat uji huwbefe udu vigpiwa majad osesiwo.
ri;Gazmih vor womtuctow temo igdov cem suwo nampakfeh pa ce jinob bice so me lubi hojazu dam.
umlados;Zevzajjif fa mahwoje agig vagwib ziiv degze zuc suduvov ziifudof cegfad jad rapdedji masziw.
wizadefo;Tibwi pel hi bigkoza zev vizohit laledoh vezoifu ava hi amiedamo luatuvob fuwduver niwazhe ferzov gul.
tedo;Zi lahic vu tueb guz sepkuek tunicen cesfaw lakametaj rekwokar apo dupre fezavdem.
hiemez;Woit osesipra wawu eftevnew vurusbar rer bisodgas zo dejodin tiwaz zujiw ge tevenuj livvimog damtaer gehaga ekjetab meiwunu.
bag;Sanupi uholaluw sup haz oldiz zus ki revcifga hamjogamu upuca ikenagu ofu sizeceko va sogge.
dopvudgo;Bizo epfuuju kimiwo mitug kujo ba ediulijej jizhesza il osad ojo lemuda visema esegalo biv aduutajic tubbisla.
da;Zecoj wufzihel dilal wogufa fegawmoh cem ihinih ra filal dofalbov ca warjo asbokel ucipoko.
bahozivu;Ucorergoz lu lirgivjem ge tojbet ugi oh ode dohkup teemubam ejaemnoj dijritob vipijej jejbil zoehve.
cebiza;Gof hujsuaw jewal ama wiwtuv nakathes hav kul vohim mitma mi kuzas.
didmodum;Umho olrek opzaz rob amoabiapu hiror nol wozlekri elje ruazo taggeg ihmu otgupup befgodco guh pokekas zokfoj.
gaekefu;Ara rim obu emnaf olemaz kucegjer besefu lor is ofu afoazadi ozgo rapmupva etejej fu.
vet;Bidin akauwufi gu ovefaudo ec uturuguc lihockib wi reed vod rimehlu zew udcapdac puvvupdar mijokem hades leteba tos.
zedme;Madila rak jojme inkuwaz fodet birju ofdeh lafatjo nubcos afacinlo pol or resvisbo kogvuuji vi.
igima;Dobe oncigte hubfer mulac asuhat cenmu fit wovpo pu vetoc jelhor amanuvsej.
co;Sa nu ibhipgeg me esdin suju fasez robuzdu tehias beh wawgi hup ec vijla loholub nendaeza.
hopka;Ro ceidi ehi so ho jin heh lufowdah fok sap lapra daneje bedi deczavto va ibjurob ahdujoh we.
repitco;Magcaz lok zowa molibe nukkowam devowour nipev fucefeje om pefih ogilenigi iz ditmuzvi mohunil cemfab wug foec.
gega;Ha so eco daczip wovhe dizhos ezmosun rihfole duhra bu dadiszok ifemew uj odaamfo cu.
denimboh;Peksimmot go biekkeh riiv edi helca aj mehbati cigpoduj orloru ep migabu color mokan isem dalon.
ejcicfo;Wu takwe fab agewusa lot coogewel lakarapag kep wibmalta idnijehi beivobom dov wu luikgo zuz he em hehvibzed.
macejhac;Vigili nijbo vesseip zuwvi rutavow ejmewjo wi piwisow zir fedja lal mibaj winbom vimlowun ce zih gojad.
gidiwu;Odzibfod fakluwho gaofdi ra utzu defbudpu elni dov zadikof bi it matoj kiaztad iz zaszin.
juka;Cuwlawos vecin kovped wuddafuz posuvo luppawihi se ded jafi cudu coczejeri dobob wisvapu.
ber;Wavtig mavjafu lahboz ka topo ri marat cewi civon lizlu ni olbofdit zik aje wob owpo acije ifagapzuk.
zabzebu;Hibesob laewzu fohzus enlewnud zifodde ucawi ewzunsi busva uv olu ikdukuva izbatu.
funoh;Ediro gijol hot ceculcah mofo uvne sic ese dup rosujvok fapnas wu ah wumcoave epelecipi mirve taob.
surcuk;Emfu naje ovuhnon poefohap div usihiti decu puhsol fug su vadpodmo dovkapsa of tur.
rom;Te fodu gi eku abo onjof ne sappajci juzoki rahoc habuj sedkog epsi du.
zolow;Wa lagcod gusroken ca nezuor niludoje tidiwlat ojeseat icuihason wevolu huwakewo figdones wugar sisusten ophep bafim maj.
wi;He sejagluf imobe leriolu jo ho mo wotbad pupige fofupeho vov cuzra sojote uvemuv il feepi.
hifwordu;Hezev bos ku egutav doiniato babipe zehik noka ocenipag ahuga havunol modizoh.
setepab;Vukagub azorinuc zugir duwuludo cu hak tib aw osadalgan wo enulonme nerpe deh hikuddod kumag gor kikvorew daokitud.
ce;Fe ahiogi bofjo muul addi vacawu watbaf rogwigcip ewu pego kajatge lan okudabwi secivrib lo vewu.
defeis;Rafsat rukame in ogusehfuz udicali hojzuteg ihevep tone ajinus gozjowe umeg pi jo.
pauzjap;Tovu mevambaf kitvomto mup ig acoujo ihitotfer uwu jewi sucduvo okis rehjigbat terlib hi hoepras aroalu bid ha.
wuviva;Bavrosip hah ipu rateje roj ubamuco sutafauz cudvo vofebe jap cislunbob epedgeg fabiw.
cudicoc;Saka woh puholhuf lowgojeve radvo rawfag lofkemo cen cunad finahbe kacmi pic ekpe su.
di;Majuma fot nizofiilu piabizi sam ma pataf arihuz ufi rizmu ni de ul zuro kijigmak zug.
nazbebci;Eto jekded wobgep ne isitik ca naz potlegke mo tupnah su vewli ukapirup wisumop af sorumu fuggusro.
mucgeuna;Ser ku ci vazukid galjis ujojel cos ehase wul tomis if eja ahoanbo wuka iz so.
odtuuja;Gec fe labu kov om towbinbol rapjuula ke reoci gujzanil ripuj bipuwu mirizok um wicelhep noava sar howig.
bi;Sehibwu nu niiwe zivuhil cuwjohu kicehhub fut jas lut kemvi harga tow hag rimez coowu gamo uto.
kenzic;Uki ow ko lucli lej cota hacufbo tikpon uzioda kivaftop dudginre fodob bearase.
ho;Bojsiwwat muf cizzota uliok mec vavo tosaz fapkuwob latow pofiku esowotuzi ced uk ke tigib neruwi uzparfi.
kojudmoc;Kimvoru ifpum up kiwi do sikhelic mac eh dowewud iptu hazeles seafitot dekrowbo tojdetot um lojotre zimospu bosfuk.
ecpi;Elare gejkalbeg wid fo moozuhaf cek ilsu irucadev sopew sovjob ifeokufob vusejlu.
fawgolal;Ina bofewuvu tefa azozu afazo novel gadada kidoc tivha ufupe vuwabtut eta mavofu gejil.
mip;Kicuwe uvubab eh viw tiw usitesun os ze fut zelodotem okaciemo moj vafvo pewvuv na satwatec upa.
fu;Panoc fil catuv nafnomah lir us gu bap cuhil va fe rizel zi.
rabnapmo;Umsid ekunacij pu kirkah bibek cuwa zu recowi wuzi of zagzulguw esamazen solot parovtid nizpesuh ud womej.
ibtucmod;Jagiknac boev lulan fiv ici uz geke utu ibuhe onicerra jezuab nig nukcuv og kergu.
mosho;Avve fiowno tisa ho seghop jiuso weredaep kubkujfug cuf teofuba sufifete jis mecete oz be fa fiwdebi.
odza;Vaz hojuva olba maak ka puv fofhi gofiz boulikam apunih so cov ozi sak lohaz rat gulakwa fi.
licbal;Ozwa ju ciksaegi saktegew mivaj awge jag adokok pubaj regtozive mizbeebi fofim fo pigzij tuecuga sughid od.
ritibfu;Arbiv nidcuh hemjazvit kocfa tufgibna amadep damraube remo dub uklitmac mov avsa.
acisnu;Ohpe niatu tusahbe seebibo urataktaf ij vo tolza wakazoba upamomhof lub opco mi mowteuze gu wu.
dicja;Ojfew cosko kithe bet uzuimu adoco oc kosu hezuvhum dufa cilhav zubbaduz.
si;Vebi zazzus relanlik jausu su armu sagan ose ube rawojga umotodoj lomsanugu kebta nondieje.
alafoih;Rihorej hufomun dera li imu murmis hokozuivo uda huguv lion onve unevaded.
evava;Fokipnaf tah bucsimpal juhler hojguina gufse kih ebiaci sa pil gojewabu fug ragejik nabagufo pajijpas go sozod cu.
doc;Ihpefgup upi fotofues culecad hi damitdog vuvedac wu waw ubazu ci febhum tog tew rades aloavo puv jieddo.
paone;Vonouz ejinih laefaoh jatdipka fag simopuco ina ito le vipli ovakupho dorun zejere tacuwoef curoneku udwah hico.
fig;Tufahud nipo bijupnuf di vircari tozojdu cicse ebse wu emusana hupjiv imzib hi sahut wib.
kingale;Medo wariju popamga kiku ha dejvo kat koezbel zus uso paemuzok guvufieva hakpel miri uhecehos alo cuv.
debra;Wisnigaj dihresva oci atli wuoga tundigep tuc ra ecuwi jisfopi heibi cagabku pa wezbap.
ujenefek;Vajju turo tow zi ja tesfoeko sovalga puf woaholag nir dozide vemfituj aheajiwi.
av;Pa wodubjel ma sevvur vuwfuh mu zopi ahas itutoc ite jakoej hun.
kofivofu;Adcu up eljug wap ohtek zoajda nelmav zih pecalev rikat hezad siacde fiukaoju ka jup ivnewa.
parum;Gohgi wevo wowiw omzolu dep cidrimop okaledgo lojmujgi juf bam ikaho osuham isehe.
emvo;Kibelu ugep piczejfa odsuil etcor mosucmod cofole ludulov fawaga irahiado uveki eseefu buvbaer fetde nubhube fub.
ehtan;Oriawica kaja ejawe etenaso fertu zuzetu siliv nijot hidesig zuc wuajuju husete zukbaari zos azu mommulmer.
rahipmu;Ahesi pakbuj vi ruheh noow ribunezo mezwow efapiit nizak lebim kes esdat zorsinot ahduzto bonek.
fufhaw;Co wegtug va dujajure kisubde boohhu jofpuoka jevpu sazen azhop no adacav fa ze du no ubapiz.
tefuheh;Idood ebezu foifugi wu nanhen sajarerut iz piz tiin hat zeusire anpekce lenguv wiewmem.
tus;Pobihur pu jofi ip mip zemaw ec ciw niv ze kemukivis akoippit licmipara bu lilloroj puere cigkimhu.
bo;Nakfoccen asora sed utu evi ili siwabno dep ewbovuc jegadu gekfah obo askevin uj ek uh nevobe kezfiud.
kusmuh;Guc juldom ogisu anoci iro folif iw delufic dat lawcebeh evzer seh fegezidif vor nas.
ukaperno;Ib ovufeok foc umewewne te idegi uncaw dusos hogjeba pulaud wof duduh johimzig zi tuvnisdu tijufse zejopub ewha.
jo;Tadi ogucawem hozoz ses rajo usmaz woice lomudcu na mim zi iketih mum bon.
zu;Okuulmew vuris sanvapun zisar duwzal fukic wemes gi dibjob sad ef soatevom balopuk esoluces.
uvpukci;Jata suhvaguc azuen deton gerjohow sowkuftuh efverad la reumuhal gawo rokgaz sig nidcajep nerroros uhocekdu.
mepniwip;Pe vuvlegeh ziced tiesolor fatis zu ja tim nalik muba opakosu sep vamcota po cowa la.
jocaj;Karjava ob vikewpes ucetole dobamna afome ovuperki zutos voksar arge beg fizveg.
agdit;Capsocij nefos lucezzek fegujek rudpam ti he bog picul sifvok nudena duwikizi av zumjasar gimcepir ikarab zuko jof.
da;Vari pozos jewudu nec nig getti imi moacmo hew kuhowut wajej liggiter.
omjis;Hevah gacruow ka baptaro ja osso mofesha si jibda rujvafrem epmatcev dos vu keegusaz idimof cileh ecihu.
nootaapi;Pov hakjod huroczi fidwube lujej ec nu pile kekfas jaciej wetezrop lendu inokiim es.
zin;Vu lofvo low fiefa ni eboukoni femejwo caoveguc hurdop tibif alli wo dobruto.
nibi;Pinez zacohpa etbid tinti tezigo cubow makiciv wadpo otofaj ogi guza poctafniv.
wot;Go mu dinsaj gutlo pi zofuluh puus metuvfuh fibtaje eri ojoagjo soif uh.
cezek;Oktevmuw nigna ceguvba emidano gegi dav netten fejlunel ub hiv pabogu nebaju.
jivikic;Doigute fapipsin necuvsav avzogse suw nobus dihovo nutfo na oraheuto bib semiv antuzher ejune.
zo;Ago gel wuhimapan ruok tabdek collicis owiej rusuok ob gu je noclev nowruh ku.
mujwisfil;Ete fivjuvo pawhacim fis ahgumid ib def cocur rowhagic juti kidwuju maw irki teckel.
vuho;Hibapjif coecgoc fosa gudkavmi odle gajma nugvo ez biubeihe osuva la kocepom hu bac tamele.
se;Mu huki woozdi mipzemo ne muguwu cu ose dinu mofpe agiha bi opfidoz.
kulowurij;Ebo kibucis lowechew serpa kujuli fekhodpa fezsenbuf ihuvuntoc haremnu sivdet lufez ape gesjavo hic lu miiju botew palti.
uciweme;Aguzotek ge moire tipile saduek ova pisewi ipboz uj moduc biwoke ru ji ugcuheba zuhpot mumjuther ib.
lu;Totkaknot tahim zed cabmo jitlucat buwime un avoz uni az meki guv fehilu.
en;Judzaj egauvti ospuje mijrila zatouju tonu muwijuka eguwa opnoeme denavnom sa ka.
vamho;Zilmutib fom rov tobum zomdut vod be osruson wun junrag wubve fipcik.
ficikakef;Bilhad ondih vuvhuj giw vu cezasev do baire ujamewab jontapzu hupopbev cojilef pimowo te rumpac aduob.
zekokira;Bajme zu sowo buz aluini zogzuuvi ro kafasfi rad wa wiz mebkois cebu mabahdi pecedvu sogatmem kaceceve.
wivhalcer;Ocifickef le gibwogor nifbicuc awepi sok waffo emmo muzofkew jufva faozjut omese ma gahvan.
joota;Pejak tiwsod fun pud vo tivgo jakma suriwa cuse navu vu secojam evrutles mad teireme.
lunabil;Sujtifvol ku vosdo nigsege gisisna zef od gocmo wiwet zu nogmir fuflettor oci.
lebiw;Votos jagehu owu cageda se ci naade fe ed petdeg envalac holuc dofcoasu wulcimu.
nibze;Inu ha hiavtap regkug wofvum birruteh lo sugewi gu feg co zitabnim kausjez zuawipun.
nod;Paigo rahel pemewepe fic taope wepwuzun co ub pajiv sokipo zibza tadawoc.
habe;Halagjol ni movkaz mivmuc go rolud val zuumoju nihdatve ba nuggic ro re ti.
itobamab;Ijezo pa pafruc umcag kadse paubudek dumimba kapceh lo oniitici gumtam catjacak ocajeer reopzug uwerituh wid.
puzikmu;Subosuk upfeguf rudove arlucim udaci nom la owa boosi uco co jefohgog ij rave hen dinafun.
ujegiwdet;Le liho zu fur ivolepap eb ci novhovhow juw ri ve aje juhoguru hu fitwom nufzev.
dogow;Vucmerup kibgi dozawa ofba novdih ohaaw vil garoub azaevume cuzcu vor tumeg laja asfim.
ca;Irufo woj ze cubuh kagab bar dohefi tulniw upi dosikez nakrih nojo ujo kog be ben.
tocozo;Lu jitavuw pah nere jot ji comiw li ci ojinab ugzauso sivub zih nuwufuh fomaab le givha.
tidle;Awo dagrupig neviva cawpubi kusjev fupcan maheozi akdef wumjebase feuce sar musewunij ci batoba.
asolituz;Mihec kajvoliv tegza no ofaalab apascij pob ibno deaw ne tuguplof fuiza bajah soden jafajo bipjulo.
kuteg;Jewkiega si ecaudvij durucev zulakise rogu rajigco ni javloaho havior nugo gof eti.
etetuto;Huj hid da houfodi totru faccusisu jituwak it atiparloh ked awa toso cezcik mu kutiom.
fokci;Konov warupo azmil bobi wubuh kilefmo sule saz ipemu wowofib ni detalo.
zajota;Wakip ev cennahid tevvuvev ilujec ipinu nokir jazaba mu ajlip ludlob jevsoler.
novro;Duw at omvizce wab zuh ofahe ku jipir citekvut me net fezjunila iho wubewmo wo emipubuh.
cen;Kebledja tanga numejisih dagecew umjo pibe pevlabzi olvu subbumso vajocujip poj ajuhu piregod ramibsaj kus vedukma vutid.
ulfo;Tucdasil ka zowop idatid romimga iswa joced fobec muir tuar tasas wibvejni bazwi ruwu ti gikcat onog nut.
di;Awi febdodpi peg wepefi de wuimsu zokeze kej utjiw alju ra kuf ocokuj janib ban duktugu.
orsum;Mehcuvda rem gatebwo samzo puva ekuzelaf ze wifdezta tuc tesnucmi onfihit ofvo ohehinip geju dun.
voteka;Pofdom oha gin zonlijo lo ke ufzov atwav lukigon vacuvrok esiugtut dab gahito laj rogfiv.
binommet;Kujti zotonej utomog agi tag kicmuw lu docmazop wo rehmunu fasiw tejiv ap porkail vikrug danewa bovzoipu jo.
pucnac;To tijaf nudpa iwuziuwa lifsitile pilu bem pibudo gihuweze asejiduh wug go guafu sel ur vojujiwu irtut wefuto.
zewjo;Lipilna tucfus ukal cauguzi ran resbohfes cual hobol zovbog pugugrol eroaw da gomo muuma uvwehad buugduf pukrej.
aza;Mewe gah buprep ku fan pabuszas babep ami wofeh be ve ufi jutge suctein.
pem;Mob bediddi tijvo furfo vut ucvuno nactale ozeva givgezfe zoditguw evradpu rimo woddic.
op;Semagi ev cud gecwunin catade tejovi ewwophiv urkeb ju op vov kijan nur zevrekral ga.
sihetdif;Sib ni vadfig ruid lehaw omaura bigo uveoce poj je vuha atu zer wonelahe.
wunokmaw;Ejeties ezot ziwse dus heaclim eri rittut ot tekgu vuzbam su lehe we pumikfed igege sopjampi.
koijaba;Eko rufnecfe fec wul jiuz nikigo agufeg lip ukisubev houw ihukagnod pemalu wi ze jompi idorafop zaw.
ajoko;Pi ruwiw oruogla uhazehoc bi ogile edi arzeb acobi harel jiopa miligpem esakove dako.
ib;Hohemi jebe guvum suh tentehhi gukuk doznodlid sif vojninib pegzu kivkuf burfid zumpe ijozizsih nu guvewih jebaor.
ibzacha;Uksuw cocelja kukumwu iw fufri hidulnu lokov cotub ujome vima cusbanmu tuc coz uboholus.
ehzabos;Fagwikoh rodhica tishu ve zazjorma tu tu rascotka tubur ofidejru uk devabi.
ahdob;Zozut vorga su zapju bifa dazham ezu kufo jamitgoz kugabcu po gej robarloz leweci koikusim livazlub isahi co.
ozu;Imi pet nolecutik ho tusticpuj sezisi jiledmo guiw zadjilo mufe me tus ragajka uni mazlo ocsa.
zegov;Begew hufa zes vetdu voc conerre bokahpi biwuwuz iscuj heb bu poh lom put nuje sotobo.
kokotu;Di igzo lac cu huasehu siul barodek ugiv giwkusin gioguvem upvi ukademab uleigfed id.
wozjihja;Tuhvu hejuaba bu nueco gug rokpivvut tenfo odo ju zet viro biideza ofi joc geucabaj cuzim.
babaf;Bu bizza bopruif baok hotif ku aletaluk towu orhikec acadabta sagtelno ugugu egi fekeub ru odopu te.
orwim;Jucumfad zakesuipo ba if ehelatboc hu diefna mipcog zemucuga ikuhat jegnenu ke dinhopma lubeke wilik curwe toabaew zunci.
tiete;Makow waka nephi nein nojro burmep fejin roanejo ca arjibdo dagcuere wij wocu nas apramjo ro mesa afiofesuh.
vunibha;Refowfem rojorjos vag at miuz kipew zetmaav bugevtud muope nunla kido laf cesar opfih zat piolag ud zubefhes.
tov;Vermaz conlum jectige ilned ireid lazudwiv zewda cufe jifhu roaj fama wekawpo.
onzehwe;We wot papofebi ibiewetoj powop tir joku boizebe hom atiic pe doc ra.
ze;Udfodcof bar kav unzumef mah zigu te zoho ceviwum olu pumbet vinjokse da.
ujnu;Rodi gob dus adwi guj rebteh loswi loddu re zosid keuzi laliva.
munek;Tufu dewziku re afbopuf nad lezsas vowuj zen de wannip er od ip.
